企业名称,注册资本,企业地址
江阴市苏合农产品生活超市有限公司,1000万元人民币,江阴市埠路桥路518号
江阴天盈纺织品有限公司,50万元人民币,江阴市临港街道海港路18号A幢112室
无锡泽天医疗器械有限公司,50万元人民币,无锡市滨湖区湖滨街11-605
江阴红泥商贸有限公司,50万元人民币,江阴市沿河路14号
无锡金斗拱建筑装饰工程有限公司,1000万元人民币,无锡市梁溪区双河村李巷79号
无锡恒佳建筑工程有限公司,500万元人民币,无锡市滨湖区住友路13-7-1
江阴市庆余堂大药房有限公司,50万元人民币,江阴市临港街道西石桥人民路113号
无锡美胜装饰工程有限公司,2000万元人民币,无锡市梁溪区广南路307-916
江阴市惠新大药房有限公司,20万元人民币,江阴市华士镇陆桥荷花南路17-3号
无锡市曼迪康新能源科技有限公司,2000万元人民币,无锡市滨湖区胡埭镇石榴路9
无锡慢时尚环保科技有限公司,500万元人民币,江阴市南闸街道金三角广场80、81号(D17馆51号4楼)
无锡锐冉商贸有限公司,100万元人民币,无锡市新吴区梅村工业集中区锡鸿路6号二层
江阴市万德望工业废物处理有限公司,500万元人民币,江阴市月城镇沿山村环山路19号
无锡市金荣市政环保工程有限公司,300万元人民币,无锡市新区鸿山街道锦鸿路313号
无锡东君建设有限公司,500万元人民币,无锡市锡山区东亭街道锡沪东路21号
宜兴市华源装饰材料有限公司,500万元人民币,宜兴市宜城街道巷头西路1号楼1号店面
江阴兰茵检测科技有限公司,500万元人民币,江阴市长山大道55号天安数码城61单元2楼
无锡阿里果果电子商务有限公司,100万元人民币,无锡市滨湖区湖滨路3号
艾普美（无锡）健康养生有限公司,100万元人民币,无锡市惠山区堰新路333-2号8015室
无锡水天堂纸制品厂,10万元人民币,无锡市新区鸿山镇后宅大新村
江阴市长泾都市丽人内衣店,,江阴市长泾镇人民路100号
江阴市西石桥珍秀建材商行,5万元人民币,江阴市临港街道东支社区程家坍35号
江苏洲振矿产能源集团有限公司,3000万元人民币,江阴市滨江西路2号12号楼3楼
梁溪区蓝邦卫浴商行,10万元人民币,无锡市锡沪中路55号（1039、1041）
无锡市优灯照明电器有限公司宜兴万家灯火分公司,,宜兴市宜城街道巷头西路25幢255号
无锡飘渺坊美容美发管理有限公司春江花园店,,无锡市锡山区东亭街道春江花园305号-1
宜兴万马装饰有限公司,500万元人民币,宜兴市宜城街道氿滨大道31号
江阴市利港小平五金店,5万元人民币,江阴市临港街道陈墅村新村54号
无锡龙奕科技有限公司,300万元人民币,无锡新区长江路7号34号地块科技园二区510室
宜兴市鸿兴盛达科技有限公司,2800万元人民币,宜兴市和桥镇永兴村大南组(和桥钢材市场内)
无锡威高健康服务有限公司,100万元人民币,无锡市红星路8号6022
江阴市青阳创想厨卫商行,5万元人民币,江阴市青阳镇青璜路60、62号
江苏嘉伦光彩大药房有限公司江阴健康源药房,,江阴市祝塘镇新庄路6号
江阴市云亭超尚发艺店,20万元人民币,江阴市云亭街道环镇南路134号
无锡趣看科技有限公司,300万元人民币,无锡市惠山经济开发区惠山大道1699号3212(开发区)
江苏嘉伦光彩大药房有限公司江阴北国药店,,江阴市顾山镇北国环镇路44号
江阴河海无纺布制品有限公司,800万元人民币,江阴市徐霞客镇璜东村
江阴市金三角心里美卫浴批发部,,江阴市南闸街道金三角广场80、81号(D区024号)
无锡安格瑞建筑安装工程有限公司,218万元人民币,无锡市锡山经济技术开发区芙蓉中三路99号
滨湖区明山装潢材料店,2万元人民币,无锡市滨湖区溪北新村279号-51
江阴市金三角资陶建材批发部,8万元人民币,江阴市金三角广场家居村L区006号
飞潮（无锡）过滤技术有限公司,659万美元,无锡市锡山经济技术开发区蓉通路71号
无锡锦峰建筑工程有限公司,300万元人民币,无锡市南湖大道588号内613-M28室
梁溪区萨瑞亚建材商行,80万元人民币,无锡市锡沪中路383号(B区41-42)
新区新安彭春岭内衣店,5万元人民币,无锡市新区新安南湖园路57号
江阴顺安物业管理有限公司,300万元人民币,江阴市长江路152号803室
江苏康之宁医药连锁有限公司无锡梁溪店,,无锡市梁溪区广瑞路555号宝锡大厦裙房一层1006室
滨湖区九荣五金洁具店,3万元人民币,无锡市滨湖区高浪东路518号金泰国际装饰城内C1-21、22
崇安区非常芯卫浴用品商行,1万元人民币,无锡市广瑞路926-16号
无锡市太湖之星电热电器有限公司,300万元人民币,无锡市滨湖区太湖街道双新经济园区
无锡金方塔物资有限公司,310万元人民币,无锡市新吴区鸿山街道鸿月路20号-6
无锡堃宇环保科技有限公司,300万元人民币,无锡市梁溪区上马墩路18号A幢808室-28
江阴洁卫德有害生物防治有限公司,300万元人民币,江阴市南闸街道锡澄路177号
无锡顺成建筑装饰工程有限公司,300万元人民币,无锡市水车湾4
江阴市精诚环境工程有限公司,300万元人民币,江阴市利港街道贵宾路158号
江阴市澄江芙罗兰护肤品店,5万元人民币,江阴市延陵路528号(江阴大润发商店街1055号)
无锡金树叶装饰工程有限公司,205万元人民币,无锡市高步沿73号A8319室
江阴市利港尹婷化妆品店,5万元人民币,江阴市临港街道利康路168号
无锡隆梵贸易有限公司,200万元人民币,无锡市上马墩路18号B幢-23
宜兴市安誉升建筑装饰工程有限公司,168万元人民币,宜兴市宜城街道人民中路107号
无锡市初灵培训服务有限公司,50万元人民币,无锡市新锡路8号无锡科技职业学院内
无锡宅加生活网络科技有限公司,208万元人民币,无锡市兴源北路818号A幢二楼202-18
无锡洁靓清洗服务有限公司,200万元人民币,无锡市塔影二村29号-55
无锡市爱佳创芯环保科技有限公司,208万元人民币,宜兴市高塍镇范道农场良种繁育场
无锡市梓麟贸易有限公司,200万元人民币,无锡市解放东路1008号15楼1509室
江阴市要塞镱朗洁具店,2万元人民币,江阴市果园路28号(新生活国际家居广场一楼8017号)
无锡创一格广告装饰有限公司,200万元人民币,无锡市惠山区钱桥钱胡公路535号
无锡志越安商贸有限公司,200万元人民币,无锡解放西路369-1511
无锡七分建筑装饰工程有限公司,202万元人民币,无锡市水车湾2
无锡赛景环保科技有限公司,200万元人民币,江阴市滨江西路2号1幢106室
上海骏君置业有限公司霞客农业生态园,,江阴市徐霞客镇南苑村(南苑村委内)
江阴市云亭凌日日用品店,2万元人民币,江阴市云亭街道云新一村50幢104室
梁溪区环义陶瓷经营部,20万元人民币,无锡市312国道黄巷立交旁华东陶瓷市场2号大库间
江阴市南闸君莎卫浴批发部,,江阴市南闸街道金三角广场80、81号(C区29号)
锡山区安镇水奢华卫浴商店,10万元人民币,无锡市锡山区安镇街道锡东大道3119
江阴市金三角宇源建材商行,50万元人民币,江阴市金三角广场家居村80号B区0楼53号
江阴市金三角普达陶瓷商行,20万元人民币,江阴市金三角建材市场宁夏路9号
无锡旺得弗商贸有限公司,150万元人民币,无锡市新吴区旺庄路158-620
无锡裕泰隆商贸有限公司,100万元人民币,无锡市新吴区江溪街道坊前锡贤路86-1号
无锡众联锡美商贸有限公司,100万元人民币,无锡市滨湖区嘉业财富中心8-2215
无锡雨之轩贸易有限公司,100万元人民币,无锡市新吴区五洲国际工业博览城53-601
无锡东裕医药科技有限公司,85万元人民币,无锡市新吴区旺庄路168-914
无锡凌创包装科技有限公司,100万元人民币,无锡市锡山区羊尖镇通羊路5号
无锡市佩奇文化传媒有限公司,100万元人民币,无锡市新吴区金城大厦2-4037
宜兴市香飘飘卡通商贸有限公司,200万元人民币,宜兴市和桥镇永兴村杨树组101室
无锡卡希尔贸易有限公司,200万元人民币,无锡市北塘区312国道西汀桥西堍(江苏神州国际汽车市场有限公司D区1329、1331室)
无锡市宏坤装饰装潢有限公司,600万元人民币,无锡市新吴区纺城大道新世界国际纺织服装城D1-06
无锡市泛盛景观装饰工程有限公司,50万元人民币,无锡市南长区银杏苑4号
宜兴嘉业恒通贸易有限公司,200万元人民币,宜兴市新街街道绿园路362号708室
无锡宏昌发商贸有限公司,201万元人民币,无锡市锡沪东路99-289
无锡晨康洗染技术服务有限公司,200万元人民币,无锡市锡山区东港镇华东村
宜兴市浦海商贸有限公司,200万元人民币,宜兴市宜城街道太滆路15号(西段2)
无锡市静嘉工程技术研究院有限公司,50万元人民币,宜兴环科园绿园路48号
宜兴市路兴建设工程有限公司,200万元人民币,宜兴经济技术开发区诸桥工业园
美蜂美妙健康科技江阴有限公司,200万元人民币,江阴市东外环路9号F座1楼
无锡天亿百汇新能源科技有限公司,200万元人民币,宜兴市新街街道南河村华泰暖通大厦1-5层
无锡雅希达建筑工程有限公司,200万元人民币,无锡市上马墩路152号2107
无锡新宏恒装饰材料有限公司,200万元人民币,无锡市锡沪路688-北63
无锡惠利斯阀门科技有限公司,200万元人民币,无锡市滨湖区山水西路69-1号
江阴市澄北姚姚日用品商店,1万元人民币,江阴市君巫路51号
无锡泰信注册安全工程师事务所有限公司,520万元人民币,无锡市新吴区旺庄路168-1420
宜兴市深宇蓝科技有限公司,200万元人民币,宜兴市徐舍镇工业园
崇安区亚固五金经营部,5万元人民币,无锡市锡沪路280号华厦家居港建材市场A212
江阴贝初国际贸易有限公司,200万元人民币,江阴市海港路18号309室
无锡市仙梅建材商行,7万元人民币,无锡市锡沪中路383号34号库
江苏嘉伦光彩大药房有限公司无锡友和药店,,无锡市惠山区钱桥街道景盛路舜柯农贸市场C5号商铺
无锡胜优多贸易有限公司,680万元人民币,宜兴市官林镇龙潭路147号
滨湖区玫瑰岛卫浴商行,3万元人民币,无锡市滨湖区太湖街道五湖大道116号
无锡旺康铃商贸有限公司,101万元人民币,无锡市滨湖区锦溪路100号
无锡市贝安特贸易有限公司,100万元人民币,无锡市新吴区城南路32-1号A区339-2室
无锡货多多电子商务有限公司,100万元人民币,无锡市新吴区金城东路301-1-1511
无锡腾顺建筑工程有限公司,200万元人民币,无锡市锡山区锡北镇八士斗山花苑216-7北一间
无锡聚合能量电子商务有限公司,100万元人民币,无锡市兴源北路818号A幢202
无锡溢泉水处理科技有限公司,100万元人民币,无锡市滨湖区太湖街道周新苑437
无锡致程高远进出口贸易有限公司,100万元人民币,无锡市锡山区安镇街道水岸佳苑安置房小区大成路1339号
无锡冠宇晨铭信息科技有限公司,100万元人民币,无锡市新吴区旺庄路158-1621
无锡邻邻团商贸有限公司,100万元人民币,无锡市新吴区江溪街道东风家园二期106号
无锡德鉴鑫建筑装饰有限公司,100万元人民币,无锡市新吴区鸿山街道鸿运路114-21号
江阴宣怡建材有限公司,201万元人民币,江阴市长江路777号20号楼359-5室(东方广场)
江阴市嘉利康健康管理有限公司,20万元人民币,江阴市夏港街道长达路11号1507
江阴市璜土派纳建材店,10万元人民币,江阴市临港新城璜土镇澄路3525号2幢1号
无锡市十六度智能科技有限公司,3000万元人民币,无锡惠山经济开发区玉祁配套区祁北路2号
江苏象装空间设计建造有限公司,1000万元人民币,无锡市新吴区龙山路2-28-201-001
江苏快猫人工智能科技有限公司,1000万元人民币,无锡市高浪东路999-2-1105、1106室
无锡旺盛医药连锁有限公司鸿山药店,,无锡市新吴区硕放街道振发二路28
无锡彼得福科技有限公司,100万元人民币,无锡市新吴区金城东路299号五洲国际工业博览城94栋109、110号
江阴市申港牛牛五金店,10万元人民币,江阴市临港街道镇澄路1644号
江苏一心寰宇生物科技有限公司,1000万元人民币,无锡市滨湖区龙山路11号
无锡旺盛医药连锁有限公司泰康堂店,,无锡市新吴区旺庄东路143-3号
无锡旺盛医药连锁有限公司南泉药店,,无锡市新吴区硕放街道云港佳园53-105
惠山区钱桥标家卫浴经营部,5万元人民币,无锡市钱桥五洲国际装饰城一期C5栋105、106、107、108号
江阴市金三角装饰城新霸卫陶经营部,1万元人民币,江阴市南闸街道金三角广场80、81号（D区04幢）
江阴市金三角闻洲洁具批发部,10万元人民币,江阴市南闸街道金三角广场80、81号(D区027号)
江阴市金三角装饰城北方卫陶批发部,1万元人民币,江阴市南闸街道金三角广场80、81号(D区019-2号)
江阴市夏港蔚然百货经营部,2万元人民币,江阴市新财盛商城内
无锡舜水环境科技有限公司,630万元人民币,宜兴市宜城街道东山西路88-1号701室
无锡镇川科技有限公司,100万元人民币,无锡市新吴区金城东路299号五洲国际工业博览城5栋121号
江阴市开泰医药零售有限公司益健路店,,江阴市益健路38号
无锡市韩鑫澄商贸有限公司,101万元人民币,无锡市金太湖国际城2128
无锡渡达者科技有限公司,100万元人民币,无锡市惠山区钱桥钱胡公路809号大学生创业园A-206-02号
无锡市御宸建筑材料有限公司,100万元人民币,无锡市上马墩路152号3288
无锡市第一空间家居有限公司,100万元人民币,无锡市惠山经济开发区锡澄南路301号好得家西区444号
无锡居美家环境科技有限公司,81万元人民币,无锡市锡山区东亭街道锡沪中路117号
无锡煜程贸易有限公司,100万元人民币,无锡市惠山区堰桥街道天润园100-11号
无锡市巨标装饰工程有限公司,100万元人民币,宜兴市丁蜀镇红卫村118号
无锡茅十八健康管理有限公司,100万元人民币,无锡市梁溪区人民中路123-1309
无锡邦洁环保技术服务有限公司,100万元人民币,无锡市滨湖区太湖街道周新苑437号506室
无锡市佳乐正其商贸有限公司,100万元人民币,无锡市滨湖区梁清路555-618
无锡诗韵天空电子商务有限公司,100万元人民币,无锡市滨湖区山水湖滨花园381-103
无锡微未来文化传媒有限公司,100万元人民币,无锡市锡山区东亭南路39-1号702室
江阴市周庄兴伟水暖店,10万元人民币,江阴市周庄镇世纪大道南段379号
江苏艾林特检测科技有限公司,1000万元人民币,无锡市滨湖区胡埭镇夏荷路10-1号
木头人电子商务无锡有限公司,500万元人民币,无锡市新吴区无锡中关村软件园11号楼201-10
朔德（无锡）电子材料有限公司,1000万元人民币,无锡市锡山区安镇街道大成工业园44号
江苏新易远贸易有限公司,1000万元人民币,宜兴市官林镇梧桐村
无锡领豪电子科技有限公司,100万元人民币,无锡市惠山区梦享城市商业广场36-625
无锡市瑞琪科贸有限公司,150万元人民币,无锡市中山路159-1501
江阴市祝塘欧联洁具店,1万元人民币,江阴市祝塘镇环北路139号
宜兴市宜城万兴建材商店,1万元人民币,宜兴市宜城街道巷头村(宜兴建材装璜市场)
江苏澜海健康科技有限公司,1000万元人民币,无锡市滨湖区梅园贾巷108
无锡市心连心大药房有限公司,30万元人民币,无锡市新区长江北路11号35、36
御贡汉方科技发展江苏有限公司,1000万元人民币,无锡惠山经济开发区智慧路33号华清创意园2栋201-2
江苏绿潽环境科技有限公司,5500万元人民币,江阴市璜土镇启港苑村许家丹2号
江苏姝馨元生物科技有限公司,8886万元人民币,宜兴市新庄街道工业集中区新中路78号
滨湖区居美嘉建材经营部,,无锡市滨湖区太湖街道五湖大道116号
江阴市璜土夜趣成人用品店,2万元人民币,江阴市璜土镇澄路3565号16栋16号
无锡海景建筑装饰工程有限公司,500万元人民币,无锡市新吴区长江北路172-6号417
江阴市长泾旺成香烛店,1万元人民币,江阴市长泾镇花园路61-10号
宜兴经济技术开发区锦涵建材经营部,10万元人民币,宜兴经济技术开发区阳泉西路188号红星美凯龙国际家居生活广场B8065
滨湖区眯呀手工皂店,2万元人民币,无锡市滨湖区隽苑1-801
宜兴市宜城街道康洁厨房用品经营部,2万元人民币,宜兴市宜城街道金属交易市场14幢158号
无锡施友环境科技有限公司,50万元人民币,无锡市新吴区鸿山街道后中村杨家浜(无锡市新华液氧储配有限公司内)
江阴市传泰建材有限公司,102万元人民币,江阴市延陵路258号
无锡康雅科技有限公司,100万元人民币,无锡惠山经济开发区智慧路33号华清创意园37栋202-1号
宜兴市翰博化工有限公司,100万元人民币,宜兴市和桥镇团结居委鹅州东路东侧综合楼1#
江苏万禾环境科技有限公司,1088万元人民币,宜兴市高塍镇高塍村
无锡皓格科技有限公司,100万元人民币,无锡惠山经济开发区洛社配套区枫杨路
宜兴共兴商贸有限公司,100万元人民币,宜兴市宜城街道金属交易市场C2幢8015.8016号
梁溪区戎美美发造型工作室,10万元人民币,无锡市扬名村耕读李巷211号
无锡艾克斯环境科技有限公司,100万元人民币,无锡市锡山区东亭友谊南路81号
江阴市益众医药有限公司,100万元人民币,江阴市临港街道利南街188号
无锡美伦装饰工程有限公司,100万元人民币,无锡市滨湖区湖滨路20号
无锡匠造信息科技有限公司,100万元人民币,无锡市滨湖区隐秀路1065
无锡市祥富盛餐饮管理有限公司,100万元人民币,无锡市建筑西路599-1幢九层968
江阴卓远母婴健康护理有限公司,100万元人民币,江阴市南闸街道南焦路288号
无锡迦南信息技术有限公司,100万元人民币,无锡市惠山区钱桥街道惠澄大道77号A楼606室
无锡昀屹商贸有限公司,81万元人民币,无锡市惠山区惠山大道9号赛格电子市场1A001(堰桥)
江阴市浩磊液压制造有限公司,100万元人民币,江阴市周庄镇滨河路110号
江阴市小滋广告传媒有限公司,100万元人民币,江阴市天鹤路132、134号
无锡泓东工程安装有限公司,50万元人民币,无锡市梁溪区阳光城市花园B区1号677
江苏群主世博贸易有限公司,1000万元人民币,江阴市永康五金城九街45号
江阴杰坤商贸有限公司,100万元人民币,江阴市顾山镇红豆村永安桥108号
江阴银淼国际贸易有限公司,100万元人民币,江阴市海港路18号337室
江阴市石庄紫云堂药房有限公司,30万元人民币,江阴市石庄启港苑综合市场272、276、278、280号
宜兴市老正电子商务有限公司,5万元人民币,宜兴市宜城街道氿滨大道759号
无锡橙洲文化传播有限公司,50万元人民币,无锡市太湖西大道258号
江阴市南闸金三角卫浪洁具商行,10万元人民币,江阴市南闸街道金三角广场80、81号(D区027号)
江苏嘉伦光彩大药房有限公司无锡欧典药店,,无锡市锡山区锡北镇张泾泉山花苑三期朝北店面房97号
无锡敦荣医药信息咨询有限公司,50万元人民币,无锡市梁溪区上马墩路160号-297
无锡市张泾端居堂参药店有限公司,50万元人民币,无锡市锡山区锡北镇张泾泾南路1号
无锡市豪顿酒店用品有限公司,50万元人民币,无锡市崇安区广益街道莫家庄248-2幢-6
江阴市微观空间装饰设计工程有限公司,543万元人民币,江阴市毗陵东路463号1115室
江阴市嘉建环境工程有限公司,500万元人民币,江阴市利港街道西石桥中街77号
江阴市醇美言商贸有限公司,50万元人民币,江阴市朝阳关路183、185号
无锡市乐筠服饰科技有限公司,50万元人民币,无锡市锡山区锡北镇芙蓉桥堍
无锡君临医药信息咨询有限公司,50万元人民币,无锡市梁溪区上马墩路160号-296
宜兴市宜乾餐饮管理服务有限公司,2001万元人民币,宜兴市丁蜀镇大浦林庄村
江阴申康药店有限公司,100万元人民币,江阴市临港街道镇东路78号
无锡东盛蓝憬建筑装饰装潢有限公司,500万元人民币,无锡市北塘区春申路47-15号(303室)
宜兴京住达实业有限公司,1000万元人民币,宜兴市新街街道绿园路489号58幢
宜兴市圣韵装饰有限公司,108万元人民币,宜兴市新街街道环科园新村路西侧
无锡大阿福信息科技有限公司,500万元人民币,无锡新区新华路5号创新创意产业园B幢313-315、317-319室
宜兴小二电子商务有限公司,100万元人民币,宜兴市屺亭街道广汇社区汇源路23号
宜兴市宜皇商贸有限公司,80万元人民币,宜兴市芳桥街道芳桥村缪中组
无锡品轩阁食品有限公司,100万元人民币,宜兴市丁蜀镇红卫村
江阴三三健康管理咨询有限公司,1000万元人民币,江阴市通渡北路299号总部壹号1501
江苏缘健贸易有限公司,1000万元人民币,无锡市梁溪区山北街道石门路会龙桥堍1-403
江苏东弘建筑装饰工程有限公司,1008万元人民币,无锡市惠山区钱桥街道惠澄大道77号综合楼515室
无锡巨美贸易有限公司,100万元人民币,无锡市梁溪区江海西路无锡市利民摩托车配件市场有限公司的营业用房1区44号一层
无锡亿儒科技有限公司,500万元人民币,无锡市清扬路81号402室
江阴赞赞家商业有限公司,1000万元人民币,江阴市澄张公路608号
宜兴市凌瑞建材有限公司,500万元人民币,宜兴市宜城街道巷头墙地砖市场11幢123号一层
无锡唯然食品生物科技有限公司,1000万元人民币,无锡市人民中路123号3510室
无锡诚和成科技有限公司,1000万元人民币,无锡市惠山区玉祁街道东环路67号
宜兴市天磊建筑装饰工程有限公司,1000万元人民币,宜兴市张渚镇桃溪路18号
江苏嘉伦光彩大药房有限公司峭岐新街药店,,江阴市徐霞客镇峭岐峭张路(新街村委对面)
江苏璜土情文化旅游发展有限公司,1000万元人民币,江阴市璜土镇璜土村东贯庄钱家头18号
江苏奥辰科技发展有限公司,1000万元人民币,无锡市惠山区新翔家园9-1117号
无锡文蕴贸易有限公司,50万元人民币,无锡市惠山区钱桥江海西路1099号
无锡奋腾建筑劳务有限公司,50万元人民币,无锡市锡山经济技术开发区友谊北路62号
无锡松果环境科技有限公司,100万元人民币,无锡市新吴区五洲国际工业博览城123幢1007
江阴欢喜汇电器有限公司,100万元人民币,江阴市梅园大街658号
江阴市金越环境工程有限公司,50万元人民币,江阴市暨阳路105号
江阴市金三角建国建材经营部,12万元人民币,金三角建材市场环东路92号
崇安区金陶洁具商行,3万元人民币,无锡市汉昌北街52-405
无锡金蜘蛛电子商务有限公司,1000万元人民币,无锡市惠山区堰桥街道堰裕路997号城投公司211-3室
江苏亮世建材科技有限公司,1000万元人民币,宜兴市屺亭街道杏里路42号
江阴市诚康大药房有限公司,10万元人民币,江阴市徐霞客镇峭岐公园路235-237号
崇安区奔龙五金商行,5万元人民币,无锡市华东商贸城10363、10375号
江阴市文林宝狮龙化妆品店,1万元人民币,江阴市祝塘镇文林富贝路69号
江阴市祝塘正茜日用品店,1万元人民币,江阴市祝塘镇文林华昌路
江阴市青阳聚祥缘黑茶店,5万元人民币,江阴市青阳镇青水阳光步行街60号
江阴市申港富贵人家洁具店,1万元人民币,江阴市临港街道崇文路543号
江苏嘉伦光彩大药房有限公司无锡杏林堂药房,,无锡市南长区健康路202号
江阴市澄北豪杰日用品商行,1万元人民币,江阴市君巫路39号8幢106室
江阴市雷春斋养生食品有限公司,50万元人民币,江阴市南街80号-2
江阴市宏兆机械有限公司,50万元人民币,江阴市周庄镇世纪大道南段780号
无锡银翔新能源科技有限公司,500万元人民币,无锡市江海西路990-2803
江阴升瑞装饰材料贸易有限公司,500万元人民币,江阴市延陵路277号
无锡市格林方商贸有限公司,52万元人民币,宜兴市宜城街道人民南路95号
无锡晨家装饰装潢有限公司,50万元人民币,无锡市会岸路88-77-344
宜兴市金程源贸易有限公司,50万元人民币,宜兴市和桥镇西横街北84号
无锡派特慈缘生物技术有限公司,10万元人民币,无锡市梁溪区五爱人家1-3
无锡雷特蒙进出口贸易有限公司,50万元人民币,无锡市江海东路447-22
江阴市长泾子杰照明器材店,0.5万元人民币,江阴市长泾镇人民路299号
宜兴市南方丰源装饰工程有限公司,500万元人民币,宜兴经济技术开发区阳泉西路188号红星美凯龙国际家居广场F7-230
无锡市奥特尔建材商行,2万元人民币,无锡市锡沪中路383号C3-5号
