name,money,addr
青岛蓝润无纺布有限公司,500万元人民币,山东省青岛市即墨市通济街道办事处嵩山二路666号
无锡奥金纳特无纺布有限公司,51万元人民币,无锡市惠山区玉祁街道芙蓉村
绍兴岁月无纺布有限公司,300万元人民币,诸暨市次坞镇上连村上俞自然村426号
潍坊志和无纺布有限公司,1000万元人民币,临朐县创新路与南环路交汇处北300米
威县全盛无纺布有限公司,200万元人民币,河北省邢台市威县方家营镇五马坊村
广州鑫旺无纺布有限公司,300万元人民币,广州市花都区狮岭镇新扬村5队(圆岭仔烧烤制品工业区)自编13号
上海秋舜无纺布有限公司,50万元人民币,上海市金山区枫泾镇环东一路88号3幢2841室
广州妍柔无纺布制品有限公司,100万元人民币,广州市白云区白云湖街唐阁东街211号二栋四楼(自主申报)
苏州市无纺布厂,150万元人民币,苏州市无纺布厂
临朐波涛无纺布厂,-,临朐波涛无纺布厂
慈溪市特种无纺布厂,108万元人民币,浙江省周巷镇周东三角站
扬州市邗江云华无纺布厂,20万元人民币,扬州市邗江云华无纺布厂
常州市湖塘热电无纺布有限公司,199万元人民币,武进区湖塘镇湾里村
扬中市凌然无纺布厂,30万元人民币,扬中市凌然无纺布厂
扬州步积成无纺布有限公司,1500万元人民币,高邮市周山镇澄营路18号
佛山市南海区绿韵无纺布有限公司,10万元人民币,佛山市南海区丹灶镇金沙东联金城工业区陆志源厂房自编5号(住所申报)
扬州市邗江金春无纺布厂,30万元人民币,扬州市邗江金春无纺布厂
佛山市佳纬无纺布有限公司,200万元人民币,佛山市三水区中心科技工业区迳口园A区11-2号(车间一)
射阳县明阳无纺布有限公司,50万元人民币,射阳县合德镇兴北西路18号
镇江金菲亚无纺布有限公司,10000万元人民币,镇江市扬中市新坝镇大全路电气工业品城8幢20号
杭州阿卡无纺布制品有限公司,50万元人民币,杭州余杭区乔司街道乔司商贸苑2幢637室
宜昌高裕无纺布有限公司,100万元人民币,宜昌市伍家岗区夷陵大道402-014号
莘县惠德利无纺布有限公司,200万元人民币,山东省聊城市莘县大王寨镇河王路(乡砖瓦厂北)
广州市永心无纺布袋有限公司,100万元人民币,广州市天河区棠东横岭一路3号A座四楼之二(部位:4C45)
南宫市邦力无纺布有限公司,20万元人民币,河北省邢台市南宫市凤岗街道办事处三里庄
苍南县绮巧无纺布有限公司,3万元人民币,苍南县灵溪镇渔塘口小区3幢9号
广州兴依隆无纺布袋有限公司,500万元人民币,广州市花都区狮岭镇益群村自编合三金狮路新二巷19号之一简易厂(可作厂房使用)
苍南全诚无纺布制品厂,-,苍南全诚无纺布制品厂
萬華無紡布實業有限公司,-,萬華無紡布實業有限公司
佛山市瑞信无纺布有限公司,3000万元人民币,佛山市南海区狮山镇官窑红星村工业区
新乐市益嘉无纺布制品有限公司,50万元人民币,新乐市木村乡木村长安街1区148号
恩平华弘水刺无纺布厂,50万港元,恩平华弘水刺无纺布厂
金华市家悦无纺布制品厂,-,金华市家悦无纺布制品厂
灯塔市隆鑫无纺布厂,-,灯塔市隆鑫无纺布厂
广州旭蓝无纺布制品有限公司,10万元人民币,广州市天河区珠吉路65号四层C418房(仅限办公用途)
藁城区卓越无纺布制袋厂,-,藁城区卓越无纺布制袋厂
安徽宏远无纺布业有限公司,2000万元人民币,安徽省合肥市经开区桃花工业园万佛山路与长古路交口
石家庄辉升无纺布有限公司,100万元人民币,石家庄辉升无纺布有限公司
辽源市永欣无纺布有限责任公司,10万元人民币,辽源市永欣无纺布有限责任公司
汕头市天为无纺布有限公司,60万元人民币,汕头市龙湖区浦江路46号南座一、二层东侧
常熟市康源无纺布有限公司,100万元人民币,常熟市支塘镇任阳丰联村
安新县利民无纺布厂,-,安新县利民无纺布厂
保定冠领无纺布有限公司,200万元人民币,白沟镇兴胜大街西侧、北环路南侧
寿光市豪宇无纺布厂,-,寿光市豪宇无纺布厂
寒亭区伟杰无纺布厂,-,寒亭区伟杰无纺布厂
河北智胜无纺布有限公司,300万元人民币,定州市明月店镇十家町村
仙桃市卓航无纺布制品有限公司,10万元人民币,湖北省仙桃市杨林尾镇杨树峰村小学
瑞安市贝妮无纺布商行,-,瑞安市贝妮无纺布商行
安庆宏芳进出口贸易有限公司,50万元人民币,桐城市新渡镇永久村土桥街8号
扬中市宏象无纺布厂,10万元人民币,扬中市宏象无纺布厂
夏邑县科序无纺布工艺品制作有限公司,200万元人民币,夏邑县城关镇职教中心西300米路南
仙桃市慧诚无纺布制品有限公司,500万元人民币,仙桃市彭场镇彭场大道南侧
保定舜盈无纺布制品有限公司,100万元人民币,河北省保定市白沟新城东芦僧工业园区008号
上海合洪无纺布制品有限公司,50万元人民币,上海市松江区乐都路18弄11-19(单)号2楼B区2022室
大连蓝赛斯无纺布制品有限公司,100万元人民币,辽宁省大连保税区中轻大厦5#楼4-A
江苏悠柔无纺布有限公司,1000万元人民币,宿迁市沭阳县刘集镇工业园区常熟路5号院内
宁夏中州无纺布制品有限公司,3000万元人民币,宁夏中州无纺布制品有限公司
广州市南柒星无纺布有限公司,500万元人民币,广州市番禺区石基镇文边村北二环路段北侧
高邑县梓淇无纺布加工厂,-,高邑县梓淇无纺布加工厂
绵阳市永盛无纺布制品厂,100万元人民币,绵阳市永盛无纺布制品厂
常州市徐帆无纺布加工厂,10万元人民币,常州市徐帆无纺布加工厂
中山市南区腾飞无纺布商行,-,中山市南区腾飞无纺布商行
白城市鸿运无纺布包装制品有限公司,20万元人民币,白城市铁路北胜利小区(锅炉房)1485号
临沂市丰凯无纺布有限公司,600万元人民币,临沂市兰山区半程金锣科技园
寒亭区双丰无纺布厂,-,寒亭区双丰无纺布厂
太仓市新建无纺布厂,40万元人民币,太仓市新建无纺布厂
温州精冠无纺布制品有限公司,100万元人民币,浙江省温州市苍南县龙港镇中山村456号
湖南省洁雅无纺布制品有限公司,500万元人民币,湖南省邵阳市邵东市大禾塘街道生态产业园互生路168号
任丘市树芳无纺布厂,-,任丘市树芳无纺布厂
瑞安市达尔意纺粘无纺布有限公司,248万元人民币,瑞安市塘下镇北堡村大南山中路
仙桃市佳妮无纺布有限公司,20万元人民币,仙桃市胡场镇周家嘴村五组
本溪沈康无纺布有限公司,100万元人民币,本溪市平山区德太街129栋1单元14号
仪征市荣鑫无纺布有限公司,50万元人民币,仪征市真州镇胥浦工业集中区天恒路668号
新宾满族自治县无纺布制品厂,30万元人民币,新宾满族自治县无纺布制品厂
新乐市正坤无纺布厂（普通合伙）,-,新乐市正坤无纺布厂（普通合伙）
东莞市恒瑞无纺布有限公司,50万元人民币,东莞市凤岗镇雁田村东深二路66号凤岗天安数码城一期三组团N4号楼1403单元
仙桃市靖昌无纺布制品有限公司,50万元人民币,仙桃市干河街道菜园一路六巷5号
宏伟无纺布厂,-,宏伟无纺布厂
佛山市胜鑫无纺布制品有限公司,30万元人民币,佛山市南海区大沥镇盐步穗盐东路花地湾雍景豪园灏景台85座109号商铺
常熟市支塘镇何市何湾无纺布厂,20万元人民币,常熟市支塘镇何市何湾无纺布厂
射阳县富洋无纺布有限公司,500万元人民币,射阳县富洋无纺布有限公司
鑫泰無紡布有限公司,-,鑫泰無紡布有限公司
泰顺县杨帆无纺布加工厂,-,泰顺县杨帆无纺布加工厂
潍坊市威达无纺布有限公司,80万元人民币,山东省潍坊市寒亭区朱里街道前周二村(健康街东街东30公里处路南)
江阴市三江宽幅无纺布有限公司,500万元人民币,江阴市徐霞客镇璜塘环东路252号
扬中市文鑫无纺布厂,60万元人民币,扬中市文鑫无纺布厂
杭州极致无纺布有限公司,100万元人民币,浙江省杭州市萧山区益农镇红阳路2-2号
宿迁艾业无纺布有限公司,100万元人民币,宿迁市沭阳县永康五金模具城E幢104室
name,money,addr
广州祥雅无纺布制品有限公司,50万元人民币,广州市白云区石槎路46号305房
广州尚兰无纺布制品有限公司,50万元人民币,广州市白云区太和镇谢家庄永利南街27号一层(自主申报)
安徽安景瑞无纺布制品有限公司,1500万元人民币,安徽省安庆市怀宁县工业园月山大道
成都聚隆无纺布有限公司广汉分公司,-,四川省德阳市广汉市向阳镇瓦店村九社
周村铭龙无纺布厂,-,周村铭龙无纺布厂
临安一希达无纺布厂,-,临安一希达无纺布厂
苍南洁康无纺布制袋厂,-,苍南洁康无纺布制袋厂
沂水县开源无纺布加工厂,-,沂水县开源无纺布加工厂
佛山市顺德区申得美无纺布有限公司,100万元人民币,佛山市顺德区龙江镇陈涌居委会325国道龙江陈涌段2-2号之一
广州明焕无纺布制品有限公司,500万元人民币,广州市白云区钟落潭镇金盆村金盆中路145号1楼(自主申报)
临海市志远无纺布有限公司,168万元人民币,浙江省台州市临海市汛桥镇利丰村
淮安锦蒙无纺布制品有限公司,50万元人民币,淮安锦蒙无纺布制品有限公司
潍坊百利无纺布厂,-,潍坊百利无纺布厂
天津市诚达无纺布有限公司,50万元人民币,天津市武清区河北屯镇南口哨村
威县雄威无纺布有限公司,300万元人民币,河北省邢台市威县经济开发区开放路18号
连云港云帆无纺布制品有限公司,100万元人民币,连云港市赣榆区赣马镇张湾子
肥西伊乐尔无纺布制品有限公司,300万元人民币,安徽省合肥市肥西县山南镇小井庄
单县鹏诺无纺布加工厂,-,单县鹏诺无纺布加工厂
扬中市万国无纺布厂,5万元人民币,扬中市万国无纺布厂
錦晨無紡布有限公司,-,錦晨無紡布有限公司
日照浣溪无纺布有限公司,50万元人民币,山东省日照市经济开发区连云港路66号
昆山优致洁无纺布材料有限公司,2000万元人民币,昆山市张浦镇大市淞沪中路25号4号房
温州市双凌无纺布厂,30万元人民币,温州市瓯海娄桥河庄
仙桃市云雁智慧无纺布制品有限公司,10万元人民币,仙桃市沙咀办杜柳居民区
义乌市政阳无纺布有限公司,100万元人民币,浙江省义乌市福田街道诚信二区诚信三街100号
宿迁弘扬无纺布有限公司,50万元人民币,宿迁市苏宿工业园区亿嘉江南水岸30栋402室
广州实诚无纺布有限公司,100万元人民币,广州市从化区街口街沙贝村1号之一
金湖东弘无纺布有限公司,100万元人民币,淮安市金湖县银涂工业集中区19号3幢
泉州市行事达无纺布有限公司,500万元人民币,福建省泉州市晋江市罗山街道苏前社区杏圃中路139号
厦门和洁无纺布制品有限公司,800万元人民币,厦门市同安工业集中区思明园159-160号
晋江市中亚无纺布制品有限公司,1000万元人民币,福建省泉州市晋江市西滨镇拥军路66号
郑州水刺无纺布有限公司,2000万元人民币,郑州水刺无纺布有限公司
佛山市晨涵无纺布有限公司,200万元人民币,佛山市南海区狮山镇谭边第一工业区自编4号(住所申报)
天津市同利隆无纺布有限公司,50万元人民币,天津市武清区崔黄口镇大宫城村东侧
东莞市利时达无纺布有限公司,10万元人民币,东莞市利时达无纺布有限公司
常熟市王氏无纺布厂,100万元人民币,常熟市王氏无纺布厂
江门市新会业丰无纺布有限公司,20万元人民币,江门市新会区会城七堡大桥工业开发区十区一号
凯俊（广州）无纺布有限公司,10万元人民币,广州市白云区太和镇夏良白庙中街6号2栋二楼(自主申报)
莘县润海无纺布厂,-,莘县润海无纺布厂
仙桃市志红无纺布制品有限公司,300万元人民币,仙桃市龙华山办事处仙源大道北侧
广州添美无纺布制品有限公司,100万元人民币,广州市天河区龙洞东街米机里1号203房
潍坊嘉诺无纺布有限公司,50万元人民币,山东省潍坊高新区清池街道府东社区健康东街以北潍安路以西创新大厦3号楼322房间
繁昌县志大无纺布有限公司,10万元人民币,繁昌县孙村经济开发区
泉州市百丝达无纺布有限公司,1777万元人民币,福建省泉州市石狮市祥芝镇祥业路69号
广州市溢羡无纺布有限公司,50万元人民币,广州市花都区狮岭镇联合村新联东路二巷7号之二
义乌市蓝芙无纺布有限公司,50万元人民币,浙江省义乌市江东街道下傅小区103栋一单元一楼(自主申报)
山东莱芬无纺布有限公司,1000万元人民币,周村区南郊镇吴家村东
广州洁美无纺布制品有限公司,50万元人民币,广州市从化区太平镇康西街268号
国桥实业（深圳）有限公司,330万美元,国桥实业（深圳）有限公司
任丘市中元无纺布厂,-,任丘市中元无纺布厂
慈溪佳奕无纺布有限公司,200万元人民币,浙江省慈溪市新浦镇西工业区经二路173号
佛山市南海区恒远无纺布有限公司,100万元人民币,佛山市南海区恒远无纺布有限公司
义乌市逸舟无纺布厂,-,义乌市逸舟无纺布厂
扬中市长城无纺布制造有限公司,50万元人民币,扬中市开发区
苍南县龙港维度无纺布商行,-,苍南县龙港维度无纺布商行
扬州市洁王无纺布有限公司,800万元人民币,杭集工业园
河北禄高水刺无纺布有限公司,7000万元人民币,巨鹿县河北巨鹿经济开发区(鲁班路北侧、三号路以东290米)
山西瑞特利无纺布制品有限公司,100万元人民币,长治市郊区马厂镇马庄村北
六安市先丰无纺布制品有限公司,100万元人民币,安徽省六安市裕安区江家店镇
广州妍婉韵无纺布制品有限公司,200万元人民币,广州市白云区白云湖街龙塘路68号涌头工业区二栋一楼
贵州杰康无纺布袋厂,-,贵州杰康无纺布袋厂
温县忠协无纺布有限公司,80万元人民币,温县一号路杨庄段路南厂区
湖北谷城洋洋无纺布有限公司,3万元人民币,湖北谷城洋洋无纺布有限公司
仙桃顺发无纺布制品有限公司彭场分公司,-,仙桃顺发无纺布制品有限公司彭场分公司
莘县康德无纺布制品店,-,莘县康德无纺布制品店
安新县浚熙无纺布制造有限公司,50万元人民币,河北省保定市安新县刘李庄镇三义村
吴兴织里至诚无纺布厂,-,吴兴织里至诚无纺布厂
扬州荣伟无纺布有限公司,1260万元人民币,扬州市江都区仙女镇张纲工业园区
六安青松无纺布有限公司,200万元人民币,安徽省六安市经济开发区东七路南
安徽鑫鼎无纺布制品有限公司,500万元人民币,安徽省合肥市肥西县经济开发区创新大道与长古路交口
上海邬桥无纺布厂,15万元人民币,奉贤区邬桥镇
天津市金龙无纺布制品有限公司,30万元人民币,天津市北辰区北仓镇北辰道津辰商贸城3号库
山亭区聚金无纺布厂,-,山亭区聚金无纺布厂
佛山市强的无纺布科技有限公司,101万元人民币,佛山市南海区狮山镇罗村北湖一路圣地广场A1座5层13A(住所申报)
苍南县和美无纺布经营部,-,苍南县和美无纺布经营部
深圳市东纺无纺布有限公司,200万元人民币,深圳市宝安区福永街道桥头路宝安大道侧A4幢第一、二层
东莞市吉泰无纺布有限公司,100万元人民币,广东省东莞市厚街镇河田第二工业区路6号1号楼101室
长葛市佳利无纺布包装厂,-,长葛市佳利无纺布包装厂
新乐林浩无纺布销售部（普通合伙）,-,新乐林浩无纺布销售部（普通合伙）
日照市祥利无纺布制品有限公司,100万元人民币,山东省日照市岚山区高兴镇北范家村
江阴今日无纺布发展有限公司,500万元人民币,江阴市徐霞客镇璜塘外环南路14号
清河县张庆无纺布厂,-,清河县张庆无纺布厂
仙桃市仙祥无纺布制品有限公司,50万元人民币,仙桃市龙华山办事处叶王民营工业园
常州市丽雅德无纺布有限公司,10万元人民币,常州市丽雅德无纺布有限公司
仙桃市亿博无纺布制品有限公司,300万元人民币,仙桃市胡场镇胡场工业园
台州仙捷无纺布有限公司,133万美元,台州仙捷无纺布有限公司
平阳县钱源无纺布制品有限公司,3万元人民币,平阳县鳌江镇前进村建岙路78号
宁波沈海无纺布有限公司,258万元人民币,慈溪市胜山镇胜山头村
扬州市英超无纺布有限公司,50万元人民币,扬州市邗江区润扬南路东横三路北
苍南金丰无纺布制品有限公司,50万元人民币,苍南金丰无纺布制品有限公司
咸阳新兴无纺布厂,41万元人民币,咸阳新兴无纺布厂
山东合益无纺布制品有限公司,1000万元人民币,山东省德州市庆云县经济开发区东环北路1988号
浙江恒海无纺布有限公司,2218万元人民币,平阳县萧江镇二期工业区
苍南县河东无纺布加工厂,-,苍南县河东无纺布加工厂
桐城市新渡吉泰无纺布工坊,-,桐城市新渡吉泰无纺布工坊
汉川市蔡林无纺布加工厂,-,汉川市蔡林无纺布加工厂
深圳美景无纺布有限公司,50万元人民币,深圳市龙岗区横岗街道安良社区福坑村35-1号201
杭州四茂无纺布有限公司,5000万元人民币,萧山区瓜沥镇大池娄村
义乌小蚕宝无纺布有限公司,100万元人民币,浙江省义乌市江东街道西陈二区20幢503室(自主申报)
仪征金泰化纤无纺布有限公司,1200万元人民币,仪征市浦西路289号
鸡泽县榆林无纺布厂,-,鸡泽县榆林无纺布厂
苍南县品质无纺布加工厂,-,苍南县品质无纺布加工厂
宿州市浩维无纺布有限公司,3600万元人民币,安徽省宿州市经济开发区金江路6号
上海至哲无纺布有限公司,500万元人民币,浦东新区老港镇老芦公路536号
张家港步康无纺布制品有限公司,100万元人民币,张家港市锦丰镇合兴洪桥村1组1幢
柳州市赛德利无纺布制品有限公司,80万元人民币,柳州市柳南区欣悦路13号柳州市鱼峰橡塑有限责任公司13-3#车间
苏州市吴中区国泰无纺布有限公司,50万元人民币,苏州吴中经济开发区旺山工业园
九江市龙腾无纺布厂,30万元人民币,九江市龙腾无纺布厂
河北三仁无纺布有限公司,300万元人民币,南宫市工业区(保安村南)
苏州艾兴无纺布制品有限公司,1947万美元,苏州市相城区高铁新城南天成路78号融瑞大厦1801室
无锡市利华无纺布有限公司,200万元人民币,无锡市惠山区玉祁街道玉蓉村
杭州叙力无纺布制品有限公司,50万元人民币,浙江省杭州市余杭区运河街道五洲路54号3幢2层
安徽省蚌无纺布厂,-,安徽省蚌无纺布厂
义乌市罗士无纺布厂,-,义乌市罗士无纺布厂
昆山艾达无纺布制品有限公司,200万美元,昆山艾达无纺布制品有限公司
丹阳市悦铭杨无纺布制品有限公司,500万元人民币,丹阳市陵口镇早巷村
清原县无纺布厂,-,清原县无纺布厂
厦门市纳丝达无纺布有限公司,1800万元人民币,厦门市集美区华陵一路1号
东莞鸿翔无纺布有限公司,100万美元,东莞市塘厦镇科苑城科苑三路3号
河南正一无纺布有限公司,1500万元人民币,长葛市增福庙乡河涯刘村
安徽亿帆无纺布制品有限公司,2000万元人民币,芜湖市高新区白马标准化5号厂房一层
寿光市沁海无纺布有限公司,200万元人民币,寿光市台头镇南洋头村村东丰台路西
河北乐桐无纺布有限公司,300万元人民币,河北省石家庄市鹿泉区石柏大街1号2号厂房
仙桃市启轩无纺布制品有限公司,20万元人民币,仙桃市沙嘴办事处王市口村
广州灿信无纺布制品有限公司,100万元人民币,广州市白云区夏花一路579号(自主申报)
南阳迅新无纺布技术咨询有限公司,50万元人民币,河南省南阳市宛城区汉冶街道光武路帝苑锦城6号楼2单元201室
杭州天力水刺无纺布有限公司,1000万元人民币,杭州天力水刺无纺布有限公司
故城县旗云无纺布厂,-,故城县旗云无纺布厂
南通康吉无纺布有限公司,100万元人民币,如皋市城北街道狮垛村13组
苍南县世欣无纺布厂,-,苍南县世欣无纺布厂
苍南县龙港镇先杰无纺布袋加工厂,-,苍南县龙港镇先杰无纺布袋加工厂
博兴县成源无纺布厂,380万元人民币,博兴县成源无纺布厂
安新县鸿润无纺布厂,-,安新县鸿润无纺布厂
常熟市金华无纺布厂,40万元人民币,常熟市金华无纺布厂
南通清叶无纺布有限公司,100万元人民币,南通市如皋市城北街道友谊路8号
广州市精诚隆无纺布厂,-,广州市精诚隆无纺布厂
任丘市金普无纺布厂,-,任丘市金普无纺布厂
阳西合兴无纺布科技有限公司,20万元人民币,阳西县中山火炬(阳西)产业转移工业园
襄阳睿阳无纺布制品有限公司,30万元人民币,枣阳市南城新华路94号
晋州市宏达无纺布厂,-,晋州市宏达无纺布厂
潍坊市坊子区华远无纺布厂,-,潍坊市坊子区华远无纺布厂
佛山市高明区俊雅无纺布加工作坊,-,佛山市高明区俊雅无纺布加工作坊
三水金华无纺布有限公司,380万美元,三水金华无纺布有限公司
晋江恒峰无纺布有限公司,3000万元人民币,晋江市安海新店东滨路20号
长沙金海无纺布有限公司,50万元人民币,长沙金海无纺布有限公司
施秉白沙无纺布有限公司,10万元人民币,贵州省黔东南苗族侗族自治州施秉县城关镇白沙井
寿光永聚福无纺布有限公司,800万元人民币,寿光市台头镇彭家道口二村东南角
寒亭区明源无纺布厂,-,寒亭区明源无纺布厂
扬中市春锦无纺布厂,50万元人民币,扬中市春锦无纺布厂
广州市伟胜无纺布有限公司,50万元人民币,广州市海珠区广州大道南1028号自编南面烜业丰纺织城第二A60号铺
仪征众和无纺布有限公司,1000万元人民币,仪征市真州镇胥浦工业集中区纵三路
玉田县金荣无纺布有限公司,60万元人民币,河北省唐山市玉田县窝洛沽镇贾言庄村
宁波锦菲无纺布有限公司,2580万元人民币,浙江省余姚市泗门镇泗北村
苍南吉纳无纺布有限公司,200万元人民币,浙江省温州市苍南县宜山镇上市街121号
恩平市弘丽无纺布制品有限公司,100万元人民币,恩平市恩城江门产业转移工业园恩平园区二区V8(机械车间)2、3幢一楼
绍兴柯桥容山无纺布有限公司,28万元人民币,浙江省绍兴市柯桥区福全镇容山村
杭州临安洁诺无纺布制品厂合伙企业（普通合伙）,-,杭州临安洁诺无纺布制品厂合伙企业（普通合伙）
广东协宏无纺布科技有限公司,1000万元人民币,佛山市南海区里水镇岗联工业区兴业路39号(住所申报)
绍兴爱蓝无纺布制品有限公司,100万元人民币,绍兴市皋埠镇银桥路317号
义乌市沃杰无纺布有限公司,50万元人民币,浙江省义乌市稠江街道杨二村31幢5单元
慈溪市三北水刺无纺布有限公司,288万元人民币,慈溪市桥头工业区
白城市探生无纺布制品有限公司,50万元人民币,白城市光明南街武警支队住宅楼1层5户
尊沁无纺布制品（上海）有限公司,100万元人民币,上海市闵行区虹梅南路4999弄4号楼2层
寒亭区庆峰无纺布厂,-,寒亭区庆峰无纺布厂
金华鑫雅蓝无纺布有限公司,200万元人民币,浙江省浦江县黄宅镇夏阳路37号(自主申报)
苍南天亨无纺布厂,-,苍南天亨无纺布厂
扬中市佳源无纺布制品有限公司,100万元人民币,镇江市扬中市八桥镇幸福村六组
保定市鸿旭无纺布制造有限公司,100万元人民币,保定市高开区贤台乡小营村
蒙阴丰农无纺布制品有限公司,200万元人民币,山东省临沂市蒙阴县野店镇商业街墅河路2号
苍南县萱轩无纺布有限公司,5万元人民币,苍南县龙港镇永兴街46号一层
江门市新会区金杰无纺布有限公司,50万元人民币,江门市新会区三江镇联和村利生围(土名)
广州美啦无纺布制品有限公司,30万元人民币,广州市白云区太和镇龙归夏良光裕街3号七楼
平阳县梦缘无纺布制品有限公司,50万元人民币,浙江省温州市平阳县昆阳镇闸桥街368号
肥西恒辉无纺布制品有限公司,200万元人民币,安徽省合肥市肥西县山南镇工业聚集区杨桃路672号
佛山市瑞之美无纺布有限公司,25万元人民币,佛山市南海区九江南方五星二队南方大德制衣厂仓库(即现南方社区卫生站右侧)
佛山市顺德区逸海无纺布制造有限公司,1970万元人民币,佛山市顺德区龙江镇涌口工业区西竣路3号
溧阳市经纬无纺布制品有限公司,100万元人民币,溧阳市昆仑街道金梧路68号
瑞安市万信无纺布袋贸易有限公司,20万元人民币,浙江省温州市瑞安市飞云街道孙桥村瑞平家园106室
宿迁鼎驰无纺布有限公司,100万元人民币,宿迁鼎驰无纺布有限公司
