name,money,addr
杭州富临无纺布有限公司,600万美元,杭州富临无纺布有限公司
苍南百纳无纺布袋厂,-,苍南百纳无纺布袋厂
安徽天沛无纺布业有限公司,2000万元人民币,霍山县衡山镇衡山工业园
重庆市荣丰无纺布有限公司,500万元人民币,重庆市沙坪坝区青木关镇官家桥村仰天窝社
湖北俊宇龙无纺布业科技有限公司,1500万元人民币,天门市经济开发区南洋大道(依贝盈公司内)
温州万景无纺布有限公司,500万元人民币,平阳县萧江镇潘南村(温州华阳纺织有限公司边)
佛山市拓盈无纺布有限公司,103万元人民币,佛山市南海区桂城街道夏东三洲股份经济社荷包湾工业开发区
漳州市新盛无纺布有限公司,500万元人民币,福建省漳州市云霄县云陵工业开发区
寒亭区恒亮无纺布厂,-,寒亭区恒亮无纺布厂
常州市盈翰无纺布有限公司,100万元人民币,武进区横林镇江村工业园区
睢宁铁风无纺布销售有限公司,50万元人民币,睢宁县官山镇工业集中区11号
绍兴柯桥仰晨无纺布有限公司,50万元人民币,浙江省绍兴市柯桥区湖塘街道湖塘村
杭州绿植无纺布有限公司,100万元人民币,拱墅区长滨街88号5幢一层119室
山东靓仪无纺布制品有限公司,300万元人民币,山东省临沂市费县大田庄乡东渐富村
泉州市长江无纺布有限责任公司,500万元人民币,福建省泉州市洛江区双阳镇双滨路8号
睢宁铁建无纺布有限公司,500万元人民币,睢宁县官山镇汤集村
苍南县瑞真无纺布袋网店,-,苍南县瑞真无纺布袋网店
四平宏图无纺布制品有限公司,50万元人民币,吉林省四平市梨树县经济开发区泉眼沟村(四平市美凯被服有限公司机械车间内)
仙桃市金池无纺布制品有限公司,50万元人民币,仙桃市沙办绿湾小区24栋一单元102室
成都无纺布厂,-,成都无纺布厂
杭州临安华宏无纺布制品有限公司,100万元人民币,浙江省杭州市临安区锦南街道杨岱村上杨路32号
杭州艺森无纺布有限公司,80万元人民币,杭州富阳区鹿山街道谢家溪村
江阴市鑫茂无纺布有限公司,200万元人民币,江阴市顾山镇顾山村
新乐市雄华无纺布厂,-,新乐市雄华无纺布厂
濮阳市龙大无纺布有限公司,300万元人民币,市黄河路西段(创业中心17号厂房)
温州华吉无纺布有限公司,50万元人民币,浙江省温州市瓯海区瞿溪街道兴革路90号
合肥佳晟无纺布制品有限公司,100万元人民币,安徽省合肥市肥东县肥东经济开发区金阳路东公园路南6号
平阳县双发无纺布制品厂,-,平阳县双发无纺布制品厂
苍南县龙港镇创大无纺布制袋厂,-,苍南县龙港镇创大无纺布制袋厂
上海茜诺无纺布有限公司,50万元人民币,上海市金山区枫泾镇和平街217号4幢
深圳市新瑞兴无纺布有限公司,80万元人民币,深圳市龙岗区平湖街道华南大道一号华南国际纺织服装原辅料物流区(一期)T15栋128号
晋州市春永无纺布厂,-,晋州市春永无纺布厂
义乌市经纬无纺布有限公司,100万元人民币,义乌市义亭镇振兴路5号
青岛曦晓无纺布有限公司,50万元人民币,山东省青岛市即墨区温泉街道岭海中路86号岭海尚溪地9号楼2单元202室
杭州昕凯瑞无纺布制品有限公司,60万元人民币,浙江省杭州市临安区锦北街道湖塘下97-1
深圳市东泰无纺布有限公司,50万元人民币,深圳市宝安区观澜街道丹湖社区人民路国升工业园厂房一栋五楼
安新县宏盛无纺布厂,-,安新县宏盛无纺布厂
石家庄宏正无纺布有限公司,300万元人民币,河北省石家庄市新乐市承安镇三合工业区
台州市路桥方耀无纺布有限公司,20万元人民币,浙江省台州市路桥区新桥镇中林村
北京伟兴无纺布制造有限公司,50万元人民币,北京市通州区宋庄镇小堡村委会东北1500米
秦皇岛市卢龙鑫源无纺布有限公司,51万元人民币,卢龙县木井乡木井村
湖南美日洁宝无纺布有限公司广州市分公司,-,广州市从化区太平镇平中大道638号
新野县明朔热风无纺布厂,-,新野县明朔热风无纺布厂
南京三立无纺布科技有限公司,20万元人民币,南京市江北新区盘城新街1号
安徽通世无纺布有限公司,500万元人民币,安徽省安庆市怀宁县工业园独秀大道18号
郑州正道无纺布制品有限公司,10万元人民币,郑州市金水区文化路68号
宿迁市金鸿无纺布袋有限公司,50万元人民币,宿迁市宿豫区新庄镇前进村二组
冠县旭恒无纺布有限公司,150万元人民币,冠县贾镇田茉莉营村
淄川寨里张波无纺布加工厂,-,淄川寨里张波无纺布加工厂
雄县国辉无纺布包装厂,-,雄县国辉无纺布包装厂
湖北佳成无纺布有限公司,500万元人民币,仙桃市仙桃市沙嘴办事处杨岗中小工业园
温州缦纱无纺布有限公司,1902.2117万元人民币,温州经济技术开发区苍兰路203号
仙桃市合永利无纺布制品有限公司,10万元人民币,仙桃市干河办事处解放大道南一巷4里1号
苍南县胡建社无纺布商行,-,苍南县胡建社无纺布商行
晋州市金圆无纺布厂,-,晋州市金圆无纺布厂
仙桃市辰海无纺布制品有限公司,20万元人民币,仙桃市龙华山沔阳大道东水产研究所院内
安徽正东无纺布有限公司,200万元人民币,安徽省安庆市桐城经济开发区兴隆东路
任丘市世恒无纺布厂,-,任丘市世恒无纺布厂
苍南县龙港宏亿无纺布厂,-,苍南县龙港宏亿无纺布厂
潍坊港鑫无纺布有限公司,100万元人民币,山东省潍坊市寒亭区朱里街道北港涘村南500米路西
仙桃市鸿亮无纺布制品有限公司,200万元人民币,仙桃市彭场镇建设正街117号
苏州铭辰无纺布有限公司,500万元人民币,杨舍镇农联村
宇源無紡布有限公司,-,宇源無紡布有限公司
嘉善县绿贝无纺布制品厂,-,嘉善县绿贝无纺布制品厂
苍南县强胜无纺布制袋厂,-,苍南县强胜无纺布制袋厂
大连市金州无纺布肩垫厂,130.4万元人民币,大连市金州无纺布肩垫厂
日照欣固无纺布有限公司,500万元人民币,山东省日照市莒县夏庄镇夏庄一村26号
太仓市松涛无纺布有限公司,5万元人民币,太仓市沙溪镇松南工业开发区
北京市房山双征无纺布厂,541.7万元人民币,北京市房山区良乡昊天大街144号
石家庄兴怡无纺布有限公司,500万元人民币,新乐市木村乡木村木前庄(机动车检测站北行300米)
常熟市支塘镇任阳欣宇无纺布厂,9.8万元人民币,常熟市支塘镇任阳欣宇无纺布厂
南宫市康森无纺布厂,-,南宫市康森无纺布厂
常州市佳胜无纺布有限公司,300万元人民币,武进区丁堰街道常丰路18号
江苏维特思无纺布有限公司,1000万元人民币,泰州市高港区永安洲镇天雨路1号
广州市海森无纺布科技有限公司,50万元人民币,广州市花都区秀全街九潭村毕村北路7号之二
武汉市无纺布厂飞达无纺布经营部,-,武汉市无纺布厂飞达无纺布经营部
泉州飞鹰无纺布有限责任公司,300万元人民币,福建省泉州经济技术开发区善丰路43号
上海凯通无纺布制造有限公司,1200万元人民币,上海市金山区山阳镇红旗东路269号
雄县众鑫无纺布制品厂,-,雄县众鑫无纺布制品厂
佛山市纤宝无纺布制品有限公司,108万元人民币,佛山市南海区狮山镇罗村广东新光源产业基地核心区内A区12座三楼之1工业厂房
东莞市中冠无纺布制品有限公司,6万元人民币,东莞市中冠无纺布制品有限公司
新乐市飞翔无纺布经销处,-,新乐市飞翔无纺布经销处
江阴市超细纤维无纺布厂,10万元人民币,江阴市临港新城利港西石桥兴西路173号
玉田县洋波无纺布有限公司,50万元人民币,河北省唐山市玉田县窝洛沽镇贾言庄村
扬州国平无纺布制品有限公司,50万元人民币,扬州市江都区仙女镇化市村西圣组316号
石家庄豪川无纺布制品有限公司,10万元人民币,河北省石家庄市无极县张段固镇北丰村村东200米路北
鹤山市稳德丰无纺布有限公司,1000万元人民币,鹤山市雅瑶镇石湖居委会
桐城市致成无纺布包装有限公司,40万元人民币,桐城市致成无纺布包装有限公司
深圳市新和荣无纺布有限公司,200万元人民币,深圳市龙岗区平湖街道上木古社区平新北路98号DCC文化创意园1栋104
桐城市泽琪无纺布厂,-,桐城市泽琪无纺布厂
苍南县龙港中祥无纺布商行,-,苍南县龙港中祥无纺布商行
重庆景程无纺布制品有限公司,150万元人民币,重庆市北碚区歇马镇天马村墙院组
扬中市浩伟无纺布厂,20万元人民币,扬中市浩伟无纺布厂
昌吉市中建上德无纺布有限公司,30万元人民币,新疆昌吉州昌吉市大西渠镇区工业园区丘41栋
深圳市奥美无纺布制品有限公司,200万元人民币,深圳市光明新区公明街道李松朗第三工业区博聚潜能工业园1栋3楼
常熟市富鸿无纺布有限公司,50万元人民币,常熟市支塘镇凯诚路1号1幢
河南鑫跃诚无纺布制品有限公司,100万元人民币,虞城县李老家乡任王楼大队黄孟庄村
福建省创美无纺布制品有限公司佛山分公司,-,佛山市南海区丹灶镇沙水路旁自编6号之一
淮安市锦鑫鸿无纺布制品有限公司,50万元人民币,淮安市锦鑫鸿无纺布制品有限公司
遂平县盛强无纺布加工厂,-,遂平县盛强无纺布加工厂
武汉荣盛达无纺布有限公司,30万元人民币,武汉市蔡甸区永安街柏木村
江苏炫翔无纺布科技有限公司,2000万元人民币,东台市通榆北路188号
河间市天明无纺布厂,-,河间市天明无纺布厂
泰州市兴隆无纺布厂,18万元人民币,泰州市兴隆无纺布厂
深圳市新一华无纺布制品有限公司,100万元人民币,深圳市龙华区龙华街道景龙社区人民北路龙泉花园3栋B504
上海盈兹无纺布有限公司,2000万元人民币,上海市金山区枫泾镇建贡路88号3幢
仙桃市天瑞无纺布制品有限公司,10万元人民币,仙桃市西流河西大街
长沙君睿无纺布有限公司,60万元人民币,湖南省长沙市宁乡县玉潭街道新城社区新城大市场五街一号
潍坊市坊子区佳骏无纺布厂,-,潍坊市坊子区佳骏无纺布厂
安新县泰昌无纺布厂,-,安新县泰昌无纺布厂
晋州朔望无纺布制品有限公司,100万元人民币,河北省石家庄市晋州市小樵镇长召村村东
苍南县维瑞无纺布制袋有限公司,10万元人民币,浙江省温州市苍南县龙港镇柳南一街49号一层
瑞安市罗凤涤纶无纺布厂,-,瑞安市罗凤涤纶无纺布厂
金湖海之缘无纺布制品有限公司,50万元人民币,江苏金湖经济开发区理士大道55号
长兴润兴无纺布厂（普通合伙）,-,长兴润兴无纺布厂（普通合伙）
怀远县天宇无纺布厂,-,怀远县天宇无纺布厂
扬州弘扬无纺布织造有限公司,3600万元人民币,广陵产业园内
浙江开杰无纺布有限公司,1100万元人民币,浙江省温州市龙港市兴业路95-151号
宜兴市金汇无纺布有限公司,126万元人民币,宜兴市湖父镇西街
金华雅洁无纺布制品有限公司,100万元人民币,浙江省金华市婺城区白龙桥镇洞溪工业区块1幢三楼
昆山佳环无纺布有限公司,100万元人民币,昆山市玉山镇城北中路1288号正泰隆国际装备采购中心8号馆8200室
佛山市美丽新无纺布制品有限公司,500万元人民币,佛山市南海区里水镇赤山工业区大同路1号2区第六层(住所申报)
佛山市顺德区尊品无纺布制品有限公司,50万元人民币,佛山市顺德区龙江镇仙塘沙龙路10号
义乌市晓晓无纺布商行,-,义乌市晓晓无纺布商行
扬州南园无纺布厂,50万元人民币,扬州南园无纺布厂
大城县牛庄艺泰无纺布厂,-,大城县牛庄艺泰无纺布厂
平阳县文浩无纺布制品厂,-,平阳县文浩无纺布制品厂
温州市爱雅无纺布有限公司,200万元人民币,浙江省温州市苍南县龙港镇临港产业基地启动区东塘路385-441号内9号楼厂房5层
义乌市跃鑫无纺布商行,-,义乌市跃鑫无纺布商行
拓邁無紡布防護用品有限公司,-,拓邁無紡布防護用品有限公司
湖州织里荣辉无纺布厂,-,湖州织里荣辉无纺布厂
博罗县仟亿无纺布有限公司,50万元人民币,博罗县石湾镇窑吓村董屋
海阳市适尔无纺布制品有限公司,1000万元人民币,海阳市适尔无纺布制品有限公司
苍南县超乾无纺布制品厂,-,苍南县超乾无纺布制品厂
河南方升无纺布制品有限公司,500万元人民币,河南省新乡市长垣市丁栾镇上官村521号
武汉绍俊宏创无纺布有限公司,50万元人民币,武汉市江夏区安山街安山社区兴安路238号
常州汉科无纺布有限公司,50万元人民币,武进区横山桥镇新安街
烟台吉新无纺布有限公司,200万元人民币,山东省烟台市芝罘区化工路59号
广州永鑫无纺布制品有限公司,50万元人民币,广州市白云区鹤龙街鹤边村鹤新路3号二社福大园区C栋26房(自主申报)
东莞市锦晨无纺布有限公司,1000万元人民币,东莞市沙田镇齐沙村田屯组轮渡路
上海独韵无纺布有限公司,50万元人民币,上海市宝山区顾北东路365号C区378
绿锦（晋江）无纺布科技有限公司,200万元人民币,福建省泉州市晋江市经济开发区(五里园)新雅路3号
苍南县浩轩针刺无纺布厂,-,苍南县浩轩针刺无纺布厂
义乌市康宁无纺布商行,-,义乌市康宁无纺布商行
青州市金嵘无纺布厂,-,青州市金嵘无纺布厂
扬州市青清无纺布厂,5万元人民币,扬州市青清无纺布厂
嘉善美琦无纺布有限公司,200万元人民币,浙江省嘉兴市嘉善县干窑镇庄驰中路88号1幢2楼
开封市华晟无纺布厂,-,开封市华晟无纺布厂
江门市叠钿无纺布有限公司,100万元人民币,江门市蓬江区杜阮镇双楼村乌娄山飞鼠佃上洞7号厂房
吉林省众鑫无纺布包装有限公司,600万元人民币,公主岭市刘房子镇政府办公楼
南通大奔无纺布有限公司,60万元人民币,南通市通州区先锋镇永安村十五组
江阴芳华无纺布有限公司,100万元人民币,江阴市华士镇华西工业园区环村西路111号
饶阳县汉聚无纺布有限公司,200万元人民币,河北省衡水市饶阳县五公镇宋桥村南19号
常熟市顺鑫无纺布厂,40万元人民币,常熟市顺鑫无纺布厂
浙江圣日无纺布有限公司,1000万元人民币,浙江省温州市泰顺县彭溪镇外洋工业区
辽源市三强无纺布有限责任公司,50万元人民币,辽源市西安区灯塔乡东孟村五组
宜昌兴源无纺布制品有限公司,175万元人民币,枝江市百里洲镇解放路106号
广州市佳凯无纺布制品有限公司,50万元人民币,广州市花都区狮岭镇新庄村下庄队五巷9号首层
齐齐哈尔市宏发无纺布厂,-,齐齐哈尔市宏发无纺布厂
江阴河海无纺布制品有限公司,800万元人民币,江阴市徐霞客镇璜东村
安庆千百汇无纺布制品有限公司,300万元人民币,安徽省安庆市怀宁县工业园独秀大道北1号
苍南双宝无纺布制品厂（普通合伙）,-,苍南双宝无纺布制品厂（普通合伙）
潍坊市坊子区合兴无纺布厂,-,潍坊市坊子区合兴无纺布厂
杭州新智无纺布制品有限公司,30万元人民币,杭州新智无纺布制品有限公司
仙桃市华辉无纺布制品有限公司,3万元人民币,仙桃市龙办叶王路136号
江苏欧杰无纺布设备有限公司,1000万元人民币,常州市钟楼区迎宾路58-8号2楼101室
仙桃市福德无纺布厂,-,仙桃市福德无纺布厂
雄县旭东无纺布制品厂,-,雄县旭东无纺布制品厂
扬州冠能无纺布有限公司,1080万元人民币,扬州冠能无纺布有限公司
湖北广发无纺布有限公司,60万美元,湖北广发无纺布有限公司
杭州申皇无纺布用品有限公司,1300万元人民币,浙江省杭州市余杭区仁和街道运溪路28-3号4楼
广州市新辉联无纺布有限公司,300万元人民币,广州市花都区花东镇莘田村开发区茨菇岭砖塘
上海山秀无纺布有限公司,100万元人民币,上海市松江区佘山镇陶干路701号5幢
河北正奇无纺布有限公司,150万元人民币,高阳县南圈头村西
上高县杰欣无纺布制造有限公司,500万元人民币,江西省宜春市上高县芦洲乡工业小区秉恬路三栋6号
常熟市金陵无纺布有限公司,2000万元人民币,常熟市支塘镇工业园北区1、2幢
连云港市振宇无纺布设备厂,30万元人民币,连云港市振宇无纺布设备厂
绍兴柯美思无纺布制品有限公司,88万元人民币,绍兴市柯桥区福全镇协兴村
成都市远祥无纺布包装有限公司,10万元人民币,成都市蒲江县鹤山镇红岩村4组1栋1楼18号
瑞安市铭乙无纺布有限公司,30万元人民币,瑞安市仙降街道上垟村
扬州市邗江远东无纺布厂,15万元人民币,扬州市邗江远东无纺布厂
无锡市兴达无纺布厂,55万元人民币,无锡市兴达无纺布厂
合肥志杰无纺布制品有限公司,50万元人民币,安徽省合肥市经济技术开发区高刘社区长岗街道新航路60号
徐州云颐无纺布制品有限公司,1000万元人民币,沛县经济开发区汉康路西侧
晋江市百丝达无纺布有限公司,286万元人民币,晋江市灵源街道灵石路林格段1-10号
潍坊方成无纺布有限公司,50万元人民币,山东省潍坊市寒亭区朱里街道方家屯村37号
温州市瓯海光荣无纺布厂,15万元人民币,瓯海三垟垟河
深圳亿林无纺布有限公司,200万元人民币,深圳市龙岗区横岗街道广达路28号
广州市鞍荣环保无纺布有限公司,308万美元,广州市花都区新华街花都大道中163号
上海劲光无纺布制品有限公司,150万元人民币,上海市金山区枫泾镇朱枫公路588号
浙江德清三禾无纺布有限公司,75万元人民币,浙江省湖州市德清县雷甸镇解放村
新乐市多姿无纺布制品有限公司,50万元人民币,新乐市木村乡木村西街20排4号
法帛太丝无纺布贸易（上海）有限公司,20万欧元,上海市长宁区遵义路150号702单元房间号753
深泽县恒泰无纺布厂,-,深泽县恒泰无纺布厂
新乐市鑫隆宏无纺布有限公司,50万元人民币,新乐市承安镇辛岸村西南
寒亭区学明无纺布厂,-,寒亭区学明无纺布厂
温州市瓯海友谊无纺布厂,20万元人民币,温州市瓯海友谊无纺布厂
宁晋县申娟无纺布厂,-,宁晋县申娟无纺布厂
晋州市宏发无纺布厂,-,晋州市宏发无纺布厂
仙桃市明强无纺布制品有限公司,100万元人民币,仙桃市彭场镇建设下街68号
寿光市永林无纺布加工厂,-,寿光市永林无纺布加工厂
仙桃市红妮无纺布制品有限责任公司,50万元人民币,仙桃市青鱼湖
日新無紡布有限公司,-,日新無紡布有限公司
尉氏县润光无纺布有限公司,100万元人民币,河南省开封市尉氏县南曹乡北曹村和谐路西66号
泉州飞鸿无纺布制品有限公司,188万元人民币,福建省泉州经济技术开发区善丰路43号
旌德县华坤无纺布有限公司,100万元人民币,安徽省宣城市旌德县蔡家桥镇三合村河东12号
石家庄市乔双无纺布制品有限公司,100万元人民币,河北省石家庄市晋州市小樵镇田村村东
石家庄市藁城区增寿无纺布厂,-,石家庄市藁城区增寿无纺布厂
郓城县明峰无纺布厂,-,郓城县明峰无纺布厂
温岭市佰特无纺布袋有限公司,50万元人民币,温岭市城南镇黄湾村189号
苍南旭光无纺布制品厂,-,苍南旭光无纺布制品厂
运彩无纺布（盐城）有限公司,100万元人民币,盐城市大丰区大桥镇桥南新街111号
仙桃市鸿保无纺布制品有限公司,100万元人民币,仙桃市干河办事处小寺垸社区二组小寺垸路3号仓库
石家庄舒适无纺布制品有限公司,50万元人民币,河北省石家庄市无极县北苏镇明秩寺村村北50米
晋江市亮剑无纺布有限公司,10万元人民币,福建省泉州市晋江市永和镇菌边村东区
阳西县威科无纺布制品有限公司,50万元人民币,阳西县新城工业三区
河北健浩无纺布有限公司,300万元人民币,新乐市黄家庄村村北
常熟市鑫联无纺布有限公司,108万元人民币,常熟市海虞镇新州村
江苏盛纺纳米材料科技股份有限公司,5955.5572万元人民币,江苏盛纺纳米材料科技股份有限公司
山东新双利无纺布有限公司,1000万元人民币,寿光市台头镇大坨村村委东南角
南康区赣纺无纺布制品厂,10万元人民币,南康区赣纺无纺布制品厂
张家港市优洁无纺布有限公司,100万元人民币,张家港市杨舍镇双鹿村
获嘉县文杰无纺布制品有限公司,200万元人民币,河南省新乡市获嘉县亢村镇河南广告标识产园3号楼
苏州工业园区华玺峰无纺布有限公司,150万元人民币,苏州工业园区唯亭镇唯新路9号唯亭工业坊B区A3厂房
安徽坤强无纺布有限公司,600万元人民币,临泉县创新路东侧西园居委会北侧
仙桃市顺荣无纺布制品有限公司,500万元人民币,仙桃市郭河镇化工小区特8号
南通大进发无纺布有限公司,200万元人民币,南通市通州区先锋镇永安村
仙桃市顺祺无纺布制品有限公司,50万元人民币,仙桃市彭场镇禾丰村
上海志祥无纺布有限公司,50万元人民币,上海市金山区枫泾镇潮枫路2516号
太仓市归庄项桥无纺布厂,3万元人民币,太仓市归庄项桥无纺布厂
潍坊泓博无纺布材料有限公司,390万元人民币,山东省潍坊市寒亭区固堤街道办事处驻地
温州市瓯海祖兴无纺布厂,15万元人民币,温州市瓯海三垟垟河
寒亭区罗成无纺布材料加工销售,-,寒亭区罗成无纺布材料加工销售
江津区瑞元无纺布厂,-,江津区瑞元无纺布厂
陕西永盛振兴无纺布有限公司,600万元人民币,陕西省咸阳市礼泉县西张堡镇再生资源产业园
上海汇京铭无纺布有限公司,50万元人民币,上海汇京铭无纺布有限公司
衢州市瑞昊无纺布有限公司,60万元人民币,浙江省衢州市东港八路13号3幢102室
广州华洁无纺布制品有限公司,1000万元人民币,广州市花都区秀全街溪秀路16号
仙桃市昌祺无纺布制品有限公司,50万元人民币,仙桃市沙嘴办沙嘴村五组
晋州市美棉壹号无纺布制品有限公司,10万元人民币,河北省石家庄市晋州市中兴路与光华街交叉口南行100米路东
河南省九恒无纺布包装有限公司,600万元人民币,汤阴县扁鹊路与惠民街交叉口东50米路北
安新县冀龙无纺布厂,-,安新县冀龙无纺布厂
胶州市双兴无纺布厂,-,胶州市双兴无纺布厂
仙桃市毅创无纺布制品有限公司,100万元人民币,仙桃市彭场镇建设正街59号
威達無紡布纖維有限公司,-,威達無紡布纖維有限公司
江苏乐合美无纺布制品有限公司,1000万元人民币,江阴市长泾镇兴业路9号
广州芳洁无纺布制品有限公司,100万元人民币,广州市白云区白云湖街大朗朗环路新榕东街8号F栋3楼(自主申报)
雄县劲松无纺布包装厂,-,雄县劲松无纺布包装厂
长垣县源康无纺布经销部,-,长垣县源康无纺布经销部
杭州超友无纺布有限公司,1000万元人民币,杭州市余杭区运河街道圣塘河村3、4幢
昌邑市无纺布厂经营部,20万元人民币,昌邑市无纺布厂经营部
南京瑞茂无纺布制品有限公司,50万元人民币,南京市溧水区东屏镇金山路14-16号
德州慧雅无纺布有限公司,100万元人民币,德州市陵城区赵家寨村518号
湖南美日洁宝无纺布有限公司,400万元人民币,湖南省湘西经济开发区广州工业园产业中心办公大楼4楼A402室
恩平进丽无纺布制品科技有限公司,50万元人民币,恩平市恩城外资民资工业区F区F45-1号(厂房)一楼
郑州文瑞无纺布制品有限公司,50万元人民币,河南省郑州市中牟县官渡镇仓寨村190号
福建天汇无纺布有限公司,10000万元人民币,连江县经济开发区管委会办公楼四层
温州启扬无纺布制品有限公司,100万元人民币,浙江省温州市苍南县望里镇马鞍村文化街179号
贵州佳垚无纺布制造有限公司,200万元人民币,贵州省黔南布依族苗族自治州龙里县开发区谷脚工业园
阳谷顺成无纺布制品有限公司,100万元人民币,山东省聊城市阳谷县祥光经济开发区东区176号 (龙大电缆东100米)
青岛丰润无纺布有限公司,10万元人民币,青岛即墨市蓝村镇文化路88号
安徽润维无纺布有限公司,2000万元人民币,安徽省宿州市朱仙庄镇
瑞安市宝隆无纺布有限公司,300万元人民币,浙江省温州市瑞安市潘岱街道林岙村堂儿前标准厂房一期一号楼
遠東無紡布有限公司,-,遠東無紡布有限公司
上海隽灏无纺布科技有限公司,100万元人民币,上海隽灏无纺布科技有限公司
平阳县陈建无纺布袋经营部（普通合伙）,-,平阳县陈建无纺布袋经营部（普通合伙）
日照毫末无纺布制品有限公司,300万元人民币,山东省日照市东港区学苑路与学海路交叉路口南300米
金华丰彩无纺布有限公司,30万元人民币,浙江省金华市婺城区工业园区九峰街139号1幢一楼北侧
