name,money,addr
云南无纺布厂（昆明市捻线厂）,144万元人民币,云南无纺布厂（昆明市捻线厂）
佛山市南海区稀雅丝无纺布有限公司,280万元人民币,佛山市南海区九江镇沙咀村(罗伞树)沙咀工业园内A座
苏州市道富丽无纺布制品有限公司,100万元人民币,苏州市道富丽无纺布制品有限公司
仙桃市宇创无纺布有限公司,100万元人民币,仙桃市彭场镇友谊路南侧(永利公司院内)
佛山晖星无纺布有限公司,120万美元,佛山晖星无纺布有限公司
胶州市荣华无纺布厂,-,胶州市荣华无纺布厂
德化县鑫德无纺布袋店,-,德化县鑫德无纺布袋店
广州膜源无纺布制品有限公司,50万元人民币,广州市白云区嘉禾街永嘉路上村永安街5号顺翔创意园D栋201房(自主申报)
诸城市荣和无纺布厂,-,诸城市荣和无纺布厂
山东丽洁无纺布科技有限公司,510万元人民币,山东省滨州市邹平县经济开发区会仙一路北首东侧
定州市隆鑫无纺布加工厂,-,定州市隆鑫无纺布加工厂
玉田县振兴无纺布有限公司,60万元人民币,河北省唐山市玉田县窝洛沽镇北
佛山市南海区西樵仁泰无纺布制品有限公司,50万元人民币,佛山市南海区西樵山根工业区
仙桃市立新无纺布有限公司,2000万元人民币,仙桃市长埫口镇石剅湾村
宁晋县士彤无纺布厂,-,宁晋县士彤无纺布厂
广州慧希无纺布有限公司,100万元人民币,广州市南沙区丰泽东路106号(自编1号楼)X1301-A8835(集群注册)(JM)
保定景芳无纺布有限公司,50万元人民币,保定市高新区大马坊乡花庄村
仙桃市拓迈无纺布防护用品有限公司,280万元人民币,仙桃市胡场镇童家咀村318国道北侧
天津鑫科无纺布有限公司,1000万元人民币,天津市武清区曹子里乡花城中路东侧综合办公楼203室-59(集中办公区)
深圳市明桥无纺布制品有限公司,30万元人民币,深圳市龙华区观湖街道观城社区金茂路2-1号一单元201、301、401
东台市越胜纺粘无纺布有限公司,100万元人民币,东台经济开发区纬二路13-2号
广州长远无纺布包装制品有限公司,8万元人民币,广州市白云区白云湖街唐阁村四社工业区2号2楼东面
绍兴柯桥瑞兴无纺布有限公司,81万元人民币,绍兴市柯桥区柯桥街道云集路151号
仙桃市雪诺无纺布制品有限公司,50万元人民币,仙桃市龙办沔阳大道东水产研究所院内
广州市星晨无纺布制品有限公司,100万元人民币,广州市白云区人和镇横沥北贤路75号1楼(自主申报)
河北洁润无纺布有限公司,300万元人民币,河北省邢台市宁晋县东汪镇艾辛庄东村村南
广州森上无纺布制品有限公司,100万元人民币,广州市天河区迎龙路162号312房(本住所限写字楼功能)
江阴市中兴无纺布有限公司,200万元人民币,江阴市顾山镇锡张路158号
杰斯曼无纺布（洛阳）有限公司,1000万美元,洛阳市吉利区科技园纬二路1号
荆州区盛兴无纺布加工厂,-,荆州区盛兴无纺布加工厂
辽源市华洋无纺布有限公司,1010万元人民币,辽源经济开发区友谊村六组
湖南斯威尼无纺布有限公司,500万元人民币,湖南省长沙市宁乡县大成桥镇梅鸣村中家组
湖北煜楠无纺布有限公司,100万元人民币,仙桃市龙华山沔阳大道113号中小企业服务中心创业大楼3楼304
义乌市乐增无纺布有限公司,10万元人民币,浙江省义乌市赤岸镇报国西路18号
山东林诺无纺布制品有限公司,600万元人民币,山东省德州市庆云县中心街明珠国际东门A3
合肥睿森无纺布制品有限公司,800万元人民币,合肥市蜀山区小庙工业园香怡路
仙桃市晨旭无纺布制品有限公司,50万元人民币,仙桃市彭场镇何场老街
邵东县永发无纺布有限公司,100万元人民币,邵东县永发无纺布有限公司
阳谷县蔬欣无纺布厂,-,阳谷县蔬欣无纺布厂
苍南县银海无纺布有限公司第二门市部,-,苍南县银海无纺布有限公司第二门市部
平泉市华维无纺布制品有限公司,3万元人民币,平泉市平泉镇城北街
河源市特利丰无纺布有限公司,1000万元人民币,河源市源城区龙岭工业园龙岭二路西边
天津恒冠无纺布有限公司,400万元人民币,北辰区大张庄镇津榆公路北津围公路东
江阴市丰泽无纺布有限公司,50万元人民币,江阴市周庄镇陶城村
广州美莱无纺布制品有限公司,50万元人民币,广州市白云区永兴龙井西路六巷2号(自主申报)
江阴市佳和无纺布有限公司,60万元人民币,江阴市华士镇陆桥村上头巷71号
新乐市洁康无纺布有限公司,50万元人民币,新乐市承安镇东王庄村村西
广州市仕璟诚无纺布制品有限公司,50万元人民币,广州市花都区花东镇保良村花都大道南3号B1栋3楼
三井化学无纺布（天津）有限公司,46956.9万元人民币,天津市西青经济开发区赛达六支路21号
太仓市沙溪镇郑利无纺布厂,2万元人民币,太仓市沙溪镇郑利无纺布厂
宁波迈希无纺布有限公司,150万元人民币,浙江省宁波市鄞州区五乡镇新诚村
成都志宏达无纺布袋有限公司,100万元人民币,成都市金牛区五里墩东路6号底层
金华市康元无纺布有限责任公司,500万元人民币,浙江省金华市婺城区金地路469号生产研发楼5楼505室
江阴市海江无纺布包装材料有限公司,600万元人民币,江阴市徐霞客镇璜塘须毛路38号
佛山市南海远东无纺布有限公司,530万美元,广东省佛山市南海区沙头镇山根工业区
平阳县格美无纺布制品厂,-,平阳县格美无纺布制品厂
河间市博伟无纺布厂,-,河间市博伟无纺布厂
平阳盛兴无纺布有限公司,1000万元人民币,平阳县鳌江镇塘下村
杭州奇美无纺布用品有限公司,50万元人民币,余杭区临平街道望梅路650号1幢
苍南县龙港凯悦无纺布制品有限公司,100万元人民币,苍南县龙港凯悦无纺布制品有限公司
苍南县金福无纺布袋厂,-,苍南县金福无纺布袋厂
武汉市汉阳区祥建无纺布厂,-,武汉市汉阳区祥建无纺布厂
保定爱灵无纺布制品制造有限公司,50万元人民币,白沟镇高雄公路北侧
苍南福久无纺布制袋厂,-,苍南福久无纺布制袋厂
诸暨市宇轩无纺布厂,-,诸暨市宇轩无纺布厂
湖北新鑫无纺布有限公司,2800万元人民币,仙桃市彭场镇太子湖工业园
泰州苏陵无纺布有限公司,108万元人民币,泰州市海陵区苏电西巷194号(1幢、3幢部分、4幢、5幢、6幢、7幢)
万美（广州）无纺布科技有限公司,200万元人民币,广州市花都区广花路168号三楼自编F座318号
广州富鑫无纺布包装制品有限公司,100万元人民币,广州市白云区人和镇庙企路广州国信工业区自编1号
西安农社链医用无纺布有限公司,100万元人民币,周至县哑柏镇裕盛村西安西亚医药用布有限公司院内
扬州茂圣无纺布有限公司,300万元人民币,扬州市邗江区公道镇创业路
温州安馨无纺布制品有限公司,300万元人民币,浙江省温州市瑞安市南滨街道围二路199号
磐安县云帆无纺布有限公司,30万元人民币,浙江省磐安县新城区欧凯路9号
安徽楚蕴无纺布制品有限公司,500万元人民币,安徽省淮南市大通区工业园区二期12号
江苏省仪征无纺布厂,2088万元人民币,仪征市真州镇马桥路7号
晋州市志丰无纺布厂,-,晋州市志丰无纺布厂
常熟市志成无纺布厂,80万元人民币,常熟市志成无纺布厂
太仓市双凤飞凤无纺布厂,20万元人民币,太仓市双凤飞凤无纺布厂
河间市煜诚无纺布制品有限公司,500万元人民币,河北省沧州市河间市留古寺镇东石相村南
西安农社链医用无纺布有限公司雁塔区分公司,-,陕西省西安市雁塔区姚家村工业园26号
晋州市康达无纺布厂,-,晋州市康达无纺布厂
上海清雅无纺布有限公司,50万元人民币,上海市青浦区白鹤镇外青松公路3560号4号楼2层东裙楼A区2474室
泉州金厚无纺布有限公司,200万元人民币,泉州市洛江区双阳华侨工业区
昆山慕晨星无纺布制品有限公司,100万元人民币,昆山市周市镇嘉裕国际商务广场2号楼410室
东莞市沙田创杰无纺布加工厂,-,东莞市沙田创杰无纺布加工厂
雄县全顺无纺布制品厂,-,雄县全顺无纺布制品厂
苏州可力特无纺布制品有限公司,50万元人民币,苏州市吴中区临湖镇湖桥工业园三区
六安市叶集区乐邦无纺布制品有限公司,100万元人民币,六安市叶集区姚李镇汇文村
广州泰瑞无纺布有限公司,100万元人民币,广州市番禺区南村镇永宁大道东4号首层
苍南县兴阳无纺布经营部,-,苍南县兴阳无纺布经营部
寒亭区鑫盛源无纺布厂,-,寒亭区鑫盛源无纺布厂
寒亭区嘉祥无纺布厂,-,寒亭区嘉祥无纺布厂
临沂市兴林无纺布有限公司,800万元人民币,山东省临沂市高新技术产业开发区马厂湖镇无梁殿村
高阳县康兴无纺布厂,-,高阳县康兴无纺布厂
潍坊兆普无纺布有限公司,60万元人民币,山东省潍坊市寒亭区朱里街道西圩渠一村75号
定州鑫泰无纺布有限公司,598万元人民币,定州市明月店镇寨西店村
淮安市威龙无纺布制品有限公司,1000万元人民币,淮安市淮安区三堡乡工业集中区66号
苍南县桦中无纺布制袋有限公司,5万元人民币,苍南县桦中无纺布制袋有限公司
巨柔（汕头）无纺布制品有限责任公司,30万元人民币,巨柔（汕头）无纺布制品有限责任公司
广州新迪无纺布长垣总经销,-,广州新迪无纺布长垣总经销
连云港美斯无纺布有限公司,1万元人民币,连云港市海州区浦南农贸市场54幢8号
重庆富雅乐无纺布有限公司,186万美元,重庆富雅乐无纺布有限公司
寿光市海泉无纺布销售店,-,寿光市海泉无纺布销售店
辛集市运泽无纺布厂,-,辛集市运泽无纺布厂
珠海市英利特无纺布有限公司,60万元人民币,珠海市金湾区联港工业区永安二路
济南天兴达无纺布有限公司,50万元人民币,山东省济南市平阴县济西工业园105国道495公里处(平阴县农机公司东邻)
广州众洁无纺布制品有限公司,100万元人民币,广州市白云区白云湖街大冈村大冈街126号二楼
湖北玖越无纺布制品有限公司,500万元人民币,湖北省天门市侨乡街道开发区高新园中小企业创业园(天门市科辰环保科技有限公司院内)
上海赛澳无纺布制造有限公司,20万元人民币,上海市金山区山阳镇红旗东路269号2幢
杭州思进无纺布有限公司,1200万元人民币,浙江省杭州余杭区运河街道博陆南街
江阴市恒优无纺布有限公司,100万元人民币,江阴市华士镇华陆路19号
安新县三利无纺布厂,-,安新县三利无纺布厂
大城县牛庄泽浩无纺布厂,-,大城县牛庄泽浩无纺布厂
安徽省太和县无纺布厂,-,安徽省太和县无纺布厂
邳州市福瑞无纺布厂,100万元人民币,邳州市福瑞无纺布厂
沙特阿拉伯SAAF无纺布公司广州代表处,-,沙特阿拉伯SAAF无纺布公司广州代表处
湖南铭裕无纺布有限公司,2000万元人民币,湖南省常德经济技术开发区德山大道333号
广州楚粤无纺布制品有限公司,30万元人民币,广州市白云区景泰街政民路27,29号2层210房(自主申报)
仙桃佳依无纺布制品有限公司,50万元人民币,仙桃市龙华山青鱼湖路刘潭路口
厦门市纳丝达无纺布有限公司宁德分公司,-,宁德市东侨经济开发区福宁北路32号幸福佳园7号楼五层
潍坊鑫盛达无纺布厂,50万元人民币,潍坊鑫盛达无纺布厂
湖北鑫的无纺布制品有限公司,300万元人民币,湖北省荆州市监利县白螺镇瞿李村五组69号
商城县天运无纺布有限公司,3699万元人民币,河南省信阳市商城县产业集聚区5号
温州友晶无纺布有限公司,100万元人民币,浙江省温州市苍南县龙港镇西三路25号
常州长华无纺布新材料有限公司,50万元人民币,常州市武进区南夏墅街道华阳村
临沂浴康源无纺布制品有限公司,200万元人民币,山东省临沂市罗庄区罗庄街道山东国际科技模具产业园A8号楼101
保定馨洁无纺布制品有限公司,100万元人民币,河北省保定市高碑店市张六庄镇色南村村南
衢州亿通无纺布有限公司,88万元人民币,浙江省衢州市衢江区岑一路29号
天台县天德无纺布厂（普通合伙）,-,天台县天德无纺布厂（普通合伙）
义乌市臧正无纺布商行,-,义乌市臧正无纺布商行
安新县金溢达无纺布厂,-,安新县金溢达无纺布厂
上海林林无纺布有限公司,50万元人民币,三林镇北街9号
长兴邦洁无纺布有限公司,10万元人民币,浙江省湖州市长兴县水口乡徽州庄村
济南市莱芜区茂盛堂无纺布有限公司,50万元人民币,山东省济南市莱芜区牛泉镇茂盛堂村西岭
苍南县龙港诚通无纺布袋厂,-,苍南县龙港诚通无纺布袋厂
苍南县伊乐无纺布商行,-,苍南县伊乐无纺布商行
平阳县梅溪无纺布制品有限公司,300万元人民币,平阳县鳌江镇包岙内村
莒南县天鹏无纺布厂,-,莒南县天鹏无纺布厂
上海石化无纺布厂,160万元人民币,上海市金山区石化龙胜路
镇江颜科无纺布有限公司,1000万元人民币,镇江市扬中市新坝镇大桥西路248号
温州市香约无纺布有限公司,100万元人民币,平阳县万全镇瑞阳村浦前路63号
宿迁市听棉无纺布有限公司,100万元人民币,沭阳县耿圩镇闸西村2158-1号厂房
常熟市新型无纺布有限公司,60万元人民币,常熟市虞山镇合丰村
苏州优衣宝无纺布有限公司,200万元人民币,苏州市吴中区临湖镇马舍村、石庄村1幢
安丘市达美无纺布厂,-,安丘市达美无纺布厂
汕头市信汇无纺布有限公司,500万元人民币,汕头市龙湖区新兴东街路7号
广州荣力无纺布有限公司工会委员会,-,广州荣力无纺布有限公司工会委员会
晋江市恒利达无纺布有限公司,888万元人民币,福建省晋江市永和菌边57号
乌鲁木齐市三鑫伟业无纺布制造有限公司,120万元人民币,乌鲁木齐市三鑫伟业无纺布制造有限公司
桐庐三阳无纺布有限公司,50万元人民币,桐庐经济开发区三达路87号
常熟市金成无纺布厂（普通合伙）,98万元人民币,常熟市金成无纺布厂（普通合伙）
东莞市舜风无纺布科技有限公司,50万元人民币,东莞市大岭山镇下高田村工业路17号第四栋一楼
河北恒渲无纺布有限公司,300万元人民币,河北省邢台市宁晋县大曹庄乡小马村村北
科德宝.宝翎无纺布（苏州）有限公司,2274万美元,江苏省苏州高新区滨河路1588号
东阳嘉和无纺布有限公司,50万元人民币,浙江省金华市东阳市江北街道月亮湾社区关山北路158-1号(自主申报)
商水县想念无纺布彩印包装有限公司,100万元人民币,河南省周口市商水县产业集聚区服饰园区C区2号
东莞市正扬无纺布科技有限公司,200万元人民币,广东省东莞市企石镇屋吓塘路8号101室
鹤山市裕达无纺布厂,-,鹤山市裕达无纺布厂
义乌市凯源无纺布加工厂,-,义乌市凯源无纺布加工厂
大理市合盛祥无纺布商行,-,大理市合盛祥无纺布商行
东台万润纺粘无纺布有限公司,50万元人民币,东台经济开发区纬六路11号
沈阳三友和无纺布有限公司,50万元人民币,沈阳市于洪区大兴街道大兴村
东营市昌润无纺布有限公司,30万元人民币,东营市昌润无纺布有限公司
宁晋县恒鑫无纺布有限公司,30万元人民币,河北省邢台市大曹庄管理区纬二街南段2号
永康市政阳无纺布有限公司,50万元人民币,浙江省金华市永康市西溪镇桐塘村长龙南路368号第五幢第一层
温州市融一无纺布制品有限公司,200万元人民币,浙江省温州市苍南县钱库镇孙家河村60号
新乐市启舜无纺布有限公司,500万元人民币,新乐市彭家庄乡小宅铺村村南(华信学院北侧)
江山市美泰无纺布厂,-,江山市美泰无纺布厂
河南织素无纺布有限公司,500万元人民币,河南省安阳市滑县桑村乡上村村118号
扬中市金叶无纺布有限公司,20万元人民币,扬中市西来桥镇复兴村九组
平阳县美达无纺布制品有限公司,20万元人民币,平阳县万全镇农大路23号
平阳县顺意无纺布制品厂,-,平阳县顺意无纺布制品厂
广州市彩鸿无纺布有限公司,50万元人民币,广州市白云区寮采北路213号101房
台州元鑫无纺布制品有限公司,30万元人民币,浙江省台州市临海市沿江镇下桥头化工区
盐城优洁无纺布有限公司,1000万元人民币,盐城市盐都区大纵湖镇工业集中区(M)
雄泰無紡布製品有限公司,-,雄泰無紡布製品有限公司
义乌市步旅无纺布厂,-,义乌市步旅无纺布厂
冠县博美无纺布制品厂,-,冠县博美无纺布制品厂
嘉兴尚兴无纺布制造有限公司,500万元人民币,嘉善县姚庄镇锦绣大道637号5幢
威海鸿宇无纺布制品有限公司,2000万元人民币,山东省威海市经济技术开发区崮山路567号(自主申报)
潍坊傲然无纺布有限公司,100万元人民币,山东省潍坊市寒亭区朱里街道前朱里村朱里公路站对面309国道路南50米
安新县浚熙无纺布制造有限公司重庆分公司,-,重庆市南岸区桂花新村249号1号楼26-8号
郑州温业达无纺布有限公司,50万元人民币,新郑市龙湖镇山西乔二组102号
仙桃威翔无纺布制品有限公司,20万元人民币,仙桃市沙嘴街道沙嘴路锦华苑南楼204
潍坊市坊子区洪杰无纺布厂,-,潍坊市坊子区洪杰无纺布厂
新乐市祥润无纺布厂,-,新乐市祥润无纺布厂
苍南县吴月无纺布加工厂,-,苍南县吴月无纺布加工厂
义乌市苇草无纺布厂,-,义乌市苇草无纺布厂
人和无纺布（河南）有限公司,2000万元人民币,河南省平顶山市石龙区贾岭村北18号
平阳县谢凯无纺布制品厂,-,平阳县谢凯无纺布制品厂
杭州思锐邦无纺布有限公司,500万元人民币,浙江省杭州市余杭区运河街道东新村十三组1幢202室
广东添华无纺布实业有限公司北环分厂,-,汕头市潮南区峡山街道北环路北洋
宽城区恒晟无纺布袋厂,-,宽城区恒晟无纺布袋厂
江门市新会区力豪无纺布有限公司,50万元人民币,江门市新会区会城城郊工业区北28号
淄博宜美无纺布制品有限公司,50万元人民币,山东省淄博市桓台县荆夏路18号
佛山市威连冠无纺布有限公司,10万元人民币,佛山市南海区狮山镇莲子塘村东北经济合作社“岚岗”地段(车间)自编2号
湖北吉品无纺布有限责任公司,400万元人民币,武汉市武昌区中北路66号
邢台市柯欣无纺布有限公司,50万元人民币,河北省邢台市宁晋县大曹庄乡小马村村东
长兴县旺华无纺布有限公司,500万元人民币,长兴县林城镇工业集中区
四川省达康无纺布厂,60万元人民币,四川省达康无纺布厂
仪征市辉腾无纺布有限公司,1000万元人民币,仪征市马集镇工业集中区三号路九号
安新县琪达无纺布厂,-,安新县琪达无纺布厂
仙桃市万鑫无纺布有限公司,800万元人民币,仙桃市彭场镇富实路南侧
寒亭区王凯无纺布厂,-,寒亭区王凯无纺布厂
邓州市国控鸿发无纺布有限公司,5000万元人民币,河南省邓州市南一环路西段南侧
临安市锦桥无纺布有限公司,50万元人民币,临安市锦桥无纺布有限公司
平阳县华秋无纺布制品厂,-,平阳县华秋无纺布制品厂
连云港市奕霖无纺布制品有限公司,518万元人民币,连云港市海州区陇海步行东街2-221#
温州协昌无纺布有限公司,400万元人民币,温州协昌无纺布有限公司
大连工贸合营金洲无纺布厂,-,大连工贸合营金洲无纺布厂
吴兴织里张莉无纺布厂,-,吴兴织里张莉无纺布厂
杭州可丽恩无纺布有限公司,30万元人民币,浙江省杭州市余杭区余杭经济技术开发区南横港社区兴元路233号2幢205室
苍南县维信无纺布袋厂,-,苍南县维信无纺布袋厂
天津富康荣达无纺布有限公司,100万元人民币,天津市宝坻区大钟庄镇康家庄村南侧
佛山市南海盈升无纺布有限公司,100万元人民币,佛山市南海区西樵镇西樵吉水村里塱检测站边土地
潜山县清涟无纺布厂,-,潜山县清涟无纺布厂
扬中市盛兴无纺布厂,5万元人民币,扬中市盛兴无纺布厂
苍南县龙港蔡氏无纺布制品有限公司,20万元人民币,浙江省温州市苍南县龙港镇柳东路8号
台州市路桥永顺无纺布厂,-,台州市路桥永顺无纺布厂
宁晋县涵硕无纺布厂,-,宁晋县涵硕无纺布厂
淮安善得无纺布制品有限公司,100万元人民币,淮安市盱眙县凹土科技园内三塘社区创业园东侧由北向南第三栋
江阴市菲尔无纺布有限公司,50万元人民币,江阴市徐霞客镇南苑村原岐南村委
大城县亚尚无纺布制品有限公司,100万元人民币,河北省廊坊市大城县平舒镇田庄村
仙桃市飞鹏无纺布制品有限公司,100万元人民币,仙桃市仙南大厦(笆篓湾)
仙桃市三智无纺布制品有限公司,200万元人民币,仙桃市张沟镇友谊路南侧1幢1层
仙桃市利军无纺布制品有限公司,800万元人民币,仙桃市彭场镇千秋南街138号
河北烁亮无纺布有限责任公司,350万元人民币,河北省邢台市隆尧县大张家庄乡杨家窑村村东
南宁森泽无纺布制品有限公司,30万元人民币,南宁市白沙大道35号南国花园商城A2栋1层A2-P-17号商铺
新乐市正恒无纺布销售店,-,新乐市正恒无纺布销售店
安国市中建无纺布有限公司,3900万元人民币,安国市子娄村南
阜康市豫通无纺布有限公司,500万元人民币,新疆昌吉州阜康市苏通小微创业园(安瑞信通管道制造有限公司院内)
东莞市誉丰无纺布有限公司,50万元人民币,东莞市大朗镇新马莲村云莲七街6号D栋1F
连云港静荣无纺布机械有限公司,680万美元,连云港市海州区新浦工业园区温岭路8-2号
佛山市洁霖无纺布制品有限公司,100万元人民币,佛山市禅城区张槎大江江海路5号四楼(住所申报)
雄县万辰无纺布制品厂,-,雄县万辰无纺布制品厂
新乐市松杉无纺布厂,-,新乐市松杉无纺布厂
海门市鑫禾无纺布厂,20万元人民币,海门市鑫禾无纺布厂
重庆市璧山区一兴无纺布销售有限公司,10万元人民币,重庆市璧山区一兴无纺布销售有限公司
晋州市蓝朋友无纺布制品有限公司,100万元人民币,河北省石家庄市晋州市东卓宿镇北白滩村村东
金寨高贝斯无纺布制品有限公司,500万元人民币,安徽省六安市金寨县白塔畈乡农民工创业园
苍南县龙港兄妹无纺布网店,-,苍南县龙港兄妹无纺布网店
重庆康煌无纺布有限公司,200万元人民币,重庆市九龙坡区白市驿镇白海路5号(2#厂房1-7交C-E轴)
潍坊地豪无纺布有限公司,200万元人民币,山东省潍坊市寒亭区朱里街办朱里一村西500米路北
宿迁联安无纺布有限公司,200万元人民币,沭阳县经济开发区温州路10号厂区内11#厂房2楼
佛山市南海必得福无纺布有限公司,6000万元人民币,广东省佛山市南海区沙头石江工业区
东莞市鑫旺无纺布有限公司,100万元人民币,广东省东莞市南城街道宏图路39号11栋288室
东莞市利诚无纺布有限公司,100万元人民币,东莞市虎门镇宏发商业广场F036、F037号
湖北爱丽斯无纺布有限公司,1000万元人民币,天门市仙北工业园绿林口大道168号
河北长隆无纺布制品有限公司,300万元人民币,河北省保定市定兴县定兴镇北祖村店村四区28号
仙桃市华亿无纺布有限公司,100万元人民币,仙桃市彭场镇振兴路
东阳市卡罗琳无纺布制品有限公司,200万元人民币,浙江省金华市东阳市白云街道望江社区兴平西路262号6楼(自主申报)
潍坊志远无纺布厂,-,潍坊志远无纺布厂
安新县汇丰无纺布厂,-,安新县汇丰无纺布厂
安新县永茂无纺布厂,-,安新县永茂无纺布厂
界首市华丰无纺布有限公司,1600万元人民币,界首市华丰无纺布有限公司
平阳县冬顺无纺布制品厂,-,平阳县冬顺无纺布制品厂
吴县黄桥无纺布厂,12.4万元人民币,吴县黄桥无纺布厂
泊头市大洪马无纺布有限公司,10万元人民币,河北省沧州市泊头市交河镇西辛阁村
寒亭区胜佳无纺布厂,-,寒亭区胜佳无纺布厂
坊子区宏源无纺布厂,-,坊子区宏源无纺布厂
任丘市威固无纺布厂,-,任丘市威固无纺布厂
汕头市澄海区澄华荣平无纺布店,-,汕头市澄海区澄华荣平无纺布店
江阴市佳天无纺布有限公司,10万元人民币,江阴市新桥镇郁桥村徐家圩1号
普兰店市双塔宏利无纺布厂,-,普兰店市双塔宏利无纺布厂
安平县力扬无纺布厂,-,安平县力扬无纺布厂
广州昊晖无纺布有限公司,100万元人民币,广州市花都区狮岭镇合成村自编合和路80号207房(仅限办公用途)
天津市捷净无纺布制品厂,100万元人民币,天津市捷净无纺布制品厂
安丘市锦和无纺布厂,-,安丘市锦和无纺布厂
