name,money,addr
湖北云中亭无纺布制品有限公司,100万元人民币,仙桃市干河街道高家渡村三组
寿光市彤鑫无纺布厂,-,寿光市彤鑫无纺布厂
容城县双友无纺布制品厂,-,容城县双友无纺布制品厂
浙江开杰无纺布有限公司制袋车间,-,苍南县龙港镇建新路210-1号南幢1楼
安新县宏信无纺布厂,-,安新县宏信无纺布厂
江阴市华思诚无纺布有限公司,3000万元人民币,江阴市周庄镇澄杨路1108号
佛山市三水恒丰盛无纺布制品有限公司,110万元人民币,佛山市三水区西南街金本开发区竹山村委会“泥坑沙”(土名)车间二
致优无纺布（无锡）有限公司,11500万美元,无锡新区锡梅西路2号
白城市弘源无纺布制品包装有限公司,50万元人民币,白城市洮北区海明东路69号楼2层
宿迁卡丽洁无纺布有限公司,100万元人民币,沭阳县山东商城B-4幢B-4-124号
义乌市绪风无纺布厂,-,义乌市绪风无纺布厂
晋州市鸿安无纺布厂,-,晋州市鸿安无纺布厂
杭州临安天福无纺布制品厂,-,杭州临安天福无纺布制品厂
湖北南天无纺布股份有限公司工会委员会,-,湖北南天无纺布股份有限公司工会委员会
平阳县乐涵无纺布制品厂,-,平阳县乐涵无纺布制品厂
镇江德尼无纺布有限公司,100万元人民币,镇江市扬中市三茅街道风帆路18号
湖北邵氏无纺布制品有限公司,500万元人民币,仙桃市彭场镇中小企业创业园
温县博雅无纺布制品有限公司,30万元人民币,温县黄河街道中张王庄村南滩3号路北
瑞安市隆升无纺布厂,-,瑞安市隆升无纺布厂
单县旺兴无纺布有限公司,600万元人民币,山东省菏泽市单县蔡堂镇孟新寨村18号
佛山市南海泰翔无纺布袋有限公司,10万元人民币,佛山市南海区里水镇草场上约“葵逢洲”自编3号
六安尚荣无纺布制品有限公司,2080万元人民币,安徽省六安市裕安区工业园
义乌市焕柔无纺布有限公司,100万元人民币,浙江省义乌市后宅街道洪华小区15幢6单元一楼(自主申报)
杭州航耀无纺布有限公司,100万元人民币,余杭区运河街道杭信村
天津合均无纺布制品有限公司,30万元人民币,天津市北辰区青光镇韩家墅村工业区幸福路16号
淄博昌合无纺布有限公司,200万元人民币,山东省淄博市高新区银泰城C座1227室
寒亭区孙凯无纺布厂,-,寒亭区孙凯无纺布厂
温州市瓯海通达无纺布厂,20万元人民币,温州市瓯海通达无纺布厂
常熟滨特尔无纺布有限公司,150万元人民币,常熟市董浜镇智林村安康路68号
长兴鸿亚无纺布加工厂,-,长兴鸿亚无纺布加工厂
潍坊市坊子区昊霖无纺布厂,-,潍坊市坊子区昊霖无纺布厂
温州强达无纺布有限公司制袋车间,-,苍南县钱库镇环城北路337号
成华区环诚无纺布包装服务中心,-,成华区环诚无纺布包装服务中心
广州市粤鸿无纺布有限公司,50万元人民币,广州市粤鸿无纺布有限公司
长沙利三无纺布厂,-,长沙利三无纺布厂
河北合达无纺布有限公司,300万元人民币,安国市卓头富强路88号
仙桃市固康无纺布用品有限公司,30万元人民币,仙桃市彭场镇挖沟村八组
安丘市鑫茂无纺布门市,-,安丘市鑫茂无纺布门市
孝感三一无纺布有限公司,300万美元,孝感三一无纺布有限公司
常熟市恒玖无纺布厂,30万元人民币,常熟市恒玖无纺布厂
长葛市正鑫无纺布有限公司,100万元人民币,长葛市石固镇朝阳村
山东正道无纺布有限公司,300万元人民币,山东省潍坊市高密市密水街道蜜水景苑18号楼10号网点
寿光市东方无纺布有限公司,8000万元人民币,寿光市羊口镇政府驻地临港工业园渤海大道以北、电厂路以东
常州市友恒无纺布有限公司,50万元人民币,武进区潞城街道东升村彭家塘
上海金昂无纺布制品有限公司,50万元人民币,青浦区赵巷镇沪青平公路3398号1幢3层A区398室
德州诚信达无纺布制品有限公司,100万元人民币,山东省德州市庆云县祥云大道东侧金融机具工贸园9栋10号
曲周县绿净源无纺布制品有限公司,100万元人民币,河北省邯郸市曲周县白寨镇娘娘寨村村西
江阴市亿玺无纺布制品有限公司,180万元人民币,江阴市徐霞客镇金凤村李巷上166号
苏州润悦福无纺布制品有限公司,100万元人民币,昆山市花桥镇新生路55号4#厂房2层
杭州富阳祥盛无纺布有限公司,500万元人民币,浙江省杭州市富阳区鹿山街道三合村
广州市妍宝无纺布制品有限公司,500万元人民币,广州市白云区军民路自编6号201房
仙桃市金蓓无纺布制品有限公司,50万元人民币,仙桃市彭场镇彭场大道北侧
常熟市永得利水刺无纺布有限公司,158万元人民币,常熟市支塘镇任阳常盛工业园
乐亭县启明无纺布制造有限公司,1000万元人民币,乐亭县大相各庄乡大相各庄村
黄山市润颜无纺布制品有限公司,500万元人民币,安徽省黄山市休宁县海阳镇黄山北路9号
杰斯曼（上海）无纺布有限公司,144万美元,上海市青浦区沪青平公路3938弄1号楼6层606室
潍坊凯歌无纺布制品有限公司,100万元人民币,昌邑市饮马镇工业园
荆州市媛媛无纺布制品有限公司,300万元人民币,荆州市城南开发区御河路57号
杭州威顿无纺布有限公司,50万元人民币,浙江省杭州市江干区笕桥街道草庄景墅草庄社区服务中心3楼341室
寿光市乐丰无纺布有限公司,100万元人民币,寿光市稻田镇潍高路与常流路交叉路口南50米
新疆鑫诚锦盛无纺布有限公司,500万元人民币,新疆昌吉州阜康市产业园阜西区苏通小微创业园二期2-10号
西宁城东鑫强无纺布厂,-,西宁城东鑫强无纺布厂
苍南县晨悦无纺布商行,-,苍南县晨悦无纺布商行
邢台强红无纺布制品有限公司,50万元人民币,河北省邢台市平乡县城文明路西段北侧
广州友连环保无纺布制品有限公司,100万元人民币,广州市天河区龙洞梁婆街1号之一106房
如东张群无纺布加工坊,10万元人民币,如东张群无纺布加工坊
建德市华辰无纺布制袋厂,-,建德市华辰无纺布制袋厂
四川兴亿无纺布制品有限公司,100万元人民币,郫县安靖镇沙湾村5组72号
郑州林丰无纺布有限公司,500万元人民币,新郑市城关乡小占庄
广州名膜无纺布制品有限公司,50万元人民币,广州市花都区新华街四和村和兴学校对面一楼(可作厂房使用)
宝鸡市鑫源无纺布厂,112万元人民币,宝鸡市鑫源无纺布厂
长兴振峰无纺布制品厂,-,长兴振峰无纺布制品厂
太仓市吉祥无纺布有限公司,50万元人民币,太仓市沙溪镇胜利村
潍坊市坊子区恒鑫无纺布厂,-,潍坊市坊子区恒鑫无纺布厂
温州腾跃无纺布制品有限公司,200万元人民币,浙江省温州市苍南县龙港镇南城路48号
日照明进无纺布制品有限公司,10万美元,日照市河山镇204国道东、山海二路南侧
沈阳市东陵区聚鑫福无纺布加工厂,-,沈阳市东陵区聚鑫福无纺布加工厂
上海花画无纺布科技有限公司,500万元人民币,上海市松江区茸华北路258号
吉安睦华无纺布有限公司,28万美元,吉安市井开区
宿迁德久无纺布有限公司,200万元人民币,宿迁市沭阳县贤官镇驻丘村三组43号
县无纺布总厂,-,县无纺布总厂
潔利康無紡布製品有限公司,-,潔利康無紡布製品有限公司
常州市金坛天甲无纺布有限公司,50万元人民币,常州市金坛区兴华路156号
东莞市泽丰无纺布有限公司,10万元人民币,东莞市塘厦镇振兴围村塘厦大道南170-1号
章丘市福园无纺布制品有限公司,3万元人民币,章丘市埠村街道办事处杨家巷村
天津宝香无纺布有限公司办事处,-,天津市和平区岳阳道59号
上海平远无纺布有限公司,200万元人民币,上海市金山区枫泾镇清水路101号156幢1层103室
湖北长鑫无纺布制品有限公司,200万元人民币,仙桃市西流河镇镇丰子垸村
平阳蓝宇无纺布制品有限公司,1200万元人民币,平阳县鳌江镇下洋埠新桥村200号
晋江市博弘无纺布制品有限公司,500万元人民币,晋江市磁灶镇张林村
广州市雅语诗无纺布制品有限公司,20万元人民币,广州市雅语诗无纺布制品有限公司
青州市远东无纺布棉被厂,-,青州市远东无纺布棉被厂
东阳市洁诺无纺布有限公司,100万元人民币,浙江省金华市东阳市白云街道望江社区望江北路109号(东阳市大公羊织造有限公司内三楼北边第一间)(自主申报)
淄博聚顺无纺布有限公司,150万元人民币,山东省淄博市临淄区朱台镇北高南村
聊城佳邦无纺布制品有限公司,30万元人民币,山东省聊城市茌平区信发街道信发路683号
温州吉昌无纺布有限公司,500万元人民币,平阳县萧江镇落马工业区
仙桃市辰亦鑫无纺布制品有限公司,50万元人民币,仙桃市彭场镇八步村四组
苍南县诺雅无纺布袋有限公司,10万元人民币,苍南县龙港镇泰兴路100号一层
浦江木帛无纺布有限公司,100万元人民币,浙江省浦江县郑家坞镇霞浦路70号
安徽省锦盛无纺布有限公司,1800万元人民币,安徽省合肥市庐江县白山镇工业集中区
广州景缘无纺布制品有限公司,100万元人民币,广州景缘无纺布制品有限公司
凌源市吉永兴无纺布制品有限公司,1000万元人民币,辽宁省朝阳市凌源市松岭子镇东道村
香港煜航無紡布製品實業有限公司,-,香港煜航無紡布製品實業有限公司
常熟市凯创无纺布有限公司,100万元人民币,常熟市支塘镇徐政村西路泾2号
金华市琪利浩无纺布制品有限公司,50万元人民币,浙江省金华市金华山旅游经济区罗店镇罗店工业园区(开心岛以南)6栋103
汕头市南亨利无纺布实业有限公司,68万元人民币,汕头市南亨利无纺布实业有限公司
重庆合巨无纺布有限公司,80万元人民币,重庆市合川区合阳城街道办事处五尊南路479号3幢
杭州雷龙无纺布有限公司,1000万元人民币,浙江省杭州市富阳区春江街道八一村
阜宁祥巨无纺布有限公司,500万元人民币,阜宁县现代服务业园区向阳东路3号(D)
深泽县长胜无纺布厂,-,深泽县长胜无纺布厂
佛山市侨布丝无纺布科技有限公司,100万元人民币,佛山市南海区丹灶镇大金工业开发区佛山市南海嘉美装饰材料有限公司厂房1号(住所申报)
庆云县腾智无纺布制品有限公司,8万元人民币,山东省德州市庆云县新兴东路、鑫盛工业园二期1号房
安新县昌博无纺布加工有限公司,20万元人民币,河北省保定市安新县刘李庄镇邸庄村
晋江永和富鸿无纺布厂,-,晋江永和富鸿无纺布厂
湖北麥德科無紡布製品有限公司,-,湖北麥德科無紡布製品有限公司
仙桃市明政无纺布制品有限公司,200万元人民币,仙桃市胡场镇铁脑垸村原金玉棉花公司
重庆康美无纺布有限公司,500万元人民币,重庆市长寿区关口长寿化工总厂内
河北蓝宝无纺布科技有限公司,1500万元人民币,河北省邢台市巨鹿县河北巨鹿经济开发区(鲁班路北197米 3号路东274米)
玉田县新泽无纺布有限公司,80万元人民币,河北省唐山市玉田县窝洛沽镇东泥窝村
安徽天韵无纺布有限公司,1100万元人民币,桐城双新经济开发区纬九路
辉宏（福建）无纺布集团有限公司,2000万元人民币,福建省南安市康美镇福新工业区
广州政武无纺布有限公司,10万元人民币,广州市白云区人和镇民强村民强路50号(空港白云)
寒亭区春城无纺布厂,-,寒亭区春城无纺布厂
嘉兴梓晶无纺布有限公司,300万元人民币,嘉善县惠民街道惠通村山鹰路87号
雄县天硕无纺布厂,-,雄县天硕无纺布厂
扬州吕玉琴无纺布厂,1万元人民币,扬州吕玉琴无纺布厂
苍南县龙港镇康源无纺布袋厂,-,苍南县龙港镇康源无纺布袋厂
新乐市鑫悦无纺布包装制品有限公司,100万元人民币,新乐市大岳镇北李家庄村村北
温州中复无纺布有限公司,100万元人民币,苍南县龙港镇凰浦村寺后73号
惠州市新瑞无纺布有限公司,50万元人民币,惠阳区新圩镇红田村
玉田县忠元无纺布有限公司,100万元人民币,河北省唐山市玉田县窝洛沽镇贾言庄村
阜南县顺达无纺布厂,-,阜南县顺达无纺布厂
义乌市欣海无纺布有限公司,100万元人民币,浙江省义乌市北苑街道留雅小区52幢2单元303(自主申报)
无锡市美而德无纺布科技有限公司,200万元人民币,无锡市新吴区菱湖大道97-1兴业楼B301-302室
苍南县王首无纺布加工厂,-,苍南县王首无纺布加工厂
长兴昊达无纺布有限公司,50万元人民币,长兴县画溪街道姚家桥村
泗阳县乾元无纺布制品有限公司,500万元人民币,泗阳县卢集镇成子湖路全民创业园
临沂精诚无纺布制品有限公司,200万元人民币,山东省临沂高新区罗西街道贾庄村
安新县飞腾无纺布厂,-,安新县飞腾无纺布厂
义乌市乐民无纺布有限公司,100万元人民币,浙江省义乌市稠江街道羊角山村198号(自主申报)
上海枫围无纺布厂有限公司,1000万元人民币,上海市金山区枫泾镇工业区亭枫公路8368号
威县献帅无纺布厂,-,威县献帅无纺布厂
温州汇中无纺布科技有限公司,500万元人民币,浙江省温州市苍南县龙港镇世纪大道699弄10号(苍南县嘉源木艺礼盒有限公司厂房内三层312室)
苍南县千牛无纺布有限公司,10万元人民币,浙江省温州市苍南县龙港镇临港产业基地园二路999号(温州金沙江实业有限公司第1幢一楼)
扬中市金祥无纺布厂,10万元人民币,扬中市金祥无纺布厂
潍坊欣荣无纺布制品有限公司,1000万元人民币,山东省潍坊市高密市姜庄镇徐家庙子村
寿光市万虹无纺布有限公司,300万元人民币,寿光市台头镇政府驻地西500米
仙桃市诚果无纺布制品有限责任公司,100万元人民币,仙桃市杨林尾镇复兴街道原派出所旧址
四川中昊无纺布有限公司,300万元人民币,四川省德阳市旌阳区永定河路38号
武强县新达无纺布厂,50万元人民币,武强县大王庄
海宁市当代无纺布制品厂,-,海宁市当代无纺布制品厂
江阴今日无纺布科技有限公司,200万元人民币,江阴市徐霞客镇璜塘外环南路14号
湖北创美无纺布制品有限公司,500万元人民币,湖北省汉川市仙女山街道办事处广场路21号1单元301-304室
海宁市德鑫无纺布有限公司,200万元人民币,浙江省嘉兴市海宁市周王庙镇新丰路5号1车间
河北建腾无纺布有限公司,500万元人民币,新乐市承安镇田村铺村村北
江苏高科无纺布有限公司,680万元人民币,盱眙经济开发区玉兰大道
深圳市鑫润丰无纺布科技有限公司,50万元人民币,深圳市龙岗区龙城街道中心城鸿基花园3栋A1014
广州市诺恩康无纺布制品有限公司,100万元人民币,广州市白云区石井街庆丰兴隆西路自编18号C2-02号
南阳市神龙无纺布有限公司,-,南阳市神龙无纺布有限公司
广东科盈无纺布科技有限公司,500万元人民币,江门市新会区三江镇良德冲博鱼口(土名)
进贤县蓝天无纺布厂,-,进贤县蓝天无纺布厂
苏州原物舍无纺布科技有限公司,300万元人民币,常熟市沙家浜镇登升路2号
海门市威波特无纺布有限公司,50万元人民币,海门市王浩镇新岸村八组
温州金川无纺布袋有限公司,3万元人民币,浙江省温州市苍南县龙港镇余北村117号
广州市彩硕无纺布有限公司,200万元人民币,广州市花都区狮岭镇狮岭大道西110铺1、2
海宁市盛隆无纺布有限公司,50万元人民币,浙江省嘉兴市海宁市长安镇辛江工业园区3路8号3幢
昆山纵凯无纺布有限公司,10万元人民币,玉山镇柏芦中路401号5A-006室
广州君林无纺布袋有限公司,200万元人民币,广州市白云区白云湖街夏茅石夏路86号-2(自主申报)
邹城市本之色无纺布制品有限公司,300万元人民币,山东省济宁市邹城市康恒路西首路北
呈贡南宇无纺布制造有限公司,50万元人民币,呈贡乌龙街道办事处上可乐社区牛头山
杭州新诚无纺布有限公司,500万元人民币,拱墅区沈半路375号
广州格森无纺布制品实业有限公司,100万元人民币,广州市花都区狮岭镇振兴村自编白水寨新村三巷2号之一第1、2层(可作厂房使用)
张家港保税区美而德无纺布制品有限公司,100万元人民币,张家港保税区汇达大厦328B室
上海金山枫围无纺布厂,-,上海金山枫围无纺布厂
黑山天正无纺布厂,-,黑山天正无纺布厂
雄县玉魁无纺布制造有限公司,30万元人民币,河北省保定市雄县朱各庄镇西柳村
周村明达无纺布制品厂,-,周村明达无纺布制品厂
佳木斯市利源无纺布有限公司,1000万元人民币,佳木斯市利源无纺布有限公司
瑞安市锦祥无纺布有限公司侨贸分公司,-,浙江省温州市瑞安市江南新区侨贸小镇物流大厦420室
安新县旭华无纺布厂,-,安新县旭华无纺布厂
苍南县宜华无纺布商行,-,苍南县宜华无纺布商行
杭州辰阳无纺布有限公司,100万元人民币,浙江省杭州市余杭区运河街道五杭唐公村庙河路11-13号2楼
苍南县龙港华元无纺布商行,-,苍南县龙港华元无纺布商行
台州富源无纺布有限公司,50万元人民币,台州市路桥区螺洋街道二友村
广东贝玉无纺布制品有限公司,500万元人民币,肇庆高新区大旺大道41号万洋众创城C61#厂房201
新乐金米德无纺布有限公司,100万元人民币,新乐市承安镇东紫烟村工业区
扶沟县海鑫无纺布有限公司,30万元人民币,河南省扶沟县崔桥镇崔桥二村
上海麦适可无纺布制品有限公司,100万元人民币,上海市松江区车墩镇莘莘路32号2893
张家港市杰华无纺布有限公司,50万元人民币,张家港市杨舍镇晨南村晨中路
中山市华沃无纺布有限公司,50万元人民币,中山市板芙镇板芙北路194号首层F区
温州国丰无纺布有限公司,100万元人民币,温州国丰无纺布有限公司
温岭市特斯无纺布有限公司,3万元人民币,温岭市特斯无纺布有限公司
常熟市支塘镇利丰无纺布厂（普通合伙）,50万元人民币,常熟市支塘镇利丰无纺布厂（普通合伙）
嘉善浩翔无纺布有限公司,100万元人民币,嘉善县干窑镇亭耀东路38号2幢1车间
仙桃市远宏无纺布制品厂,35万元人民币,仙桃市远宏无纺布制品厂
广州美妍无纺布有限公司,20万元人民币,广州市白云区均禾街清湖新庄北街22号A栋302
杭州萧山小爱无纺布商行,-,杭州萧山小爱无纺布商行
安新县平川无纺布厂,-,安新县平川无纺布厂
宁阳县环洁无纺布有限公司,160万元人民币,泰安市宁阳县八仙桥街道办事处金阳大街西首(环城科技产业园内)
东莞市虎门东侨无纺布店,-,东莞市虎门东侨无纺布店
潍坊市坊子区成成无纺布厂,-,潍坊市坊子区成成无纺布厂
仙桃市富钰无纺布制品厂,-,仙桃市富钰无纺布制品厂
宜春市浩宇无纺布制品有限公司,100万元人民币,宜春市浩宇无纺布制品有限公司
苍南县龙港张晨无纺布商行,-,苍南县龙港张晨无纺布商行
潍坊开发区鸢都无纺布开发公司,4500万元人民币,潍坊开发区鸢都无纺布开发公司
山东晶鑫无纺布制品有限公司青岛分公司,-,青岛市李沧区京口路106号4号楼1111
温州市爱干净无纺布制品有限公司,50万元人民币,浙江省温州市鹿城区黄龙住宅区登峰17幢205室-1(仅限办公使用)
广州洁美无纺布用品有限公司,100万元人民币,广州市白云区永平街东平蛟腾街东巷4号(自主申报)
浙江天润无纺布有限公司,800万元人民币,浙江省兰溪市马涧镇工业园B区
济南欧鑫无纺布有限公司,100万元人民币,山东省济南市天桥区兴业路118号
安新县宏伟无纺布厂,-,安新县宏伟无纺布厂
江阴市伟创无纺布业科技有限公司,100万元人民币,江阴市周庄镇砂山路
冠县鸿运无纺布有限公司,400万元人民币,冠县清泉街道办事处五里韩村
广州市双源无纺布有限公司,30万元人民币,广州市南沙区东涌镇小乌工业区
江阴美而德无纺布制品有限公司,100万元人民币,江阴市长泾镇兴业路9号
山东龙口无纺布厂,200万元人民币,山东龙口无纺布厂
灌南县汇龙无纺布有限公司,100万元人民币,连云港市灌南县新安镇金佩家园D2#
平阳县利君无纺布制品经营部,-,平阳县利君无纺布制品经营部
仙桃市柯速达无纺布制品有限公司,1000万元人民币,仙桃市沙湖镇胜利正街(原中心百货大楼)
浦江芊祥无纺布有限公司,100万元人民币,浙江省浦江县仙华街道永在大道909号
义乌市启明星无纺布有限公司,500万元人民币,浙江省义乌市廿三里街道乾元路26号(自主申报)
杭州新福华无纺布有限公司,500万元人民币,杭州余杭区运河街道滩里村
仙桃市华旭无纺布制品有限公司,50万元人民币,仙桃市钱沟副食品批发市场主大楼四楼
广州爱森霖无纺布制品有限公司,10万元人民币,广州市荔湾区环市西路35号之十二、十七、二十四2层214铺自编之一
合肥胜林无纺布制品有限公司,20万元人民币,肥东经济开发区公园路北祥和路西
江苏新意无纺布有限公司,500万元人民币,如皋市江安镇宁通居9组1号
仙桃市达康无纺布制品有限公司,50万元人民币,仙桃市彭场镇陈剅村三组
宁晋县辉天无纺布厂,-,宁晋县辉天无纺布厂
瑞安市宇豪无纺布制品厂,-,瑞安市宇豪无纺布制品厂
潍坊忠君无纺布有限公司,100万元人民币,山东省潍坊市寒亭区朱里街道赵家庄村东300米路北
安新县华阳无纺布制品制造有限公司,100万元人民币,安新县新容公路西
尉氏县盛泰无纺布有限公司,300万元人民币,河南省开封市尉氏县朱曲镇黄庄村13号
启东三强无纺布有限公司,1000万元人民币,启东市近海盐场滨海工业园区
潍坊市无纺布厂,357.3万元人民币,潍坊市无纺布厂
连云港柏兴无纺布制品有限公司,1000万美元,连云港市东海县晶都大道1069号
东海县兴辰无纺布制品有限公司,200万元人民币,东海县经济开发区北区、顺发路北、兴辰路西侧
苍南县亚农无纺布商行,-,苍南县亚农无纺布商行
普洱新大无纺布制造有限公司,100万元人民币,云南省普洱市工业园区木乃河片区
河间市润达无纺布厂,-,河间市润达无纺布厂
长兴县越兴无纺布有限公司,50万元人民币,长兴县越兴无纺布有限公司
寿光市乾诚无纺布厂,-,寿光市乾诚无纺布厂
晋州市京华无纺布厂,-,晋州市京华无纺布厂
荆沙市长宏无纺布厂,468万元人民币,荆沙市长宏无纺布厂
高阳县陈标强无纺布厂,-,高阳县陈标强无纺布厂
武义永润无纺布有限公司,20万元人民币,浙江省金华市武义县履坦镇岗头工业区(浙江众环机电设备有限公司内)
晋州市锦诚无纺布厂,-,晋州市锦诚无纺布厂
浙江生源无纺布业有限公司,600万元人民币,德清县钟管镇干村村
潍坊市坊子区融鑫无纺布厂,-,潍坊市坊子区融鑫无纺布厂
苍南县庄龙无纺布厂,-,苍南县庄龙无纺布厂
浙江富瑞森水刺无纺布股份有限公司,1500万元人民币,嘉兴市南湖区新丰工业园区
浙江鑫恒无纺布有限公司,2000万元人民币,浙江省温州市苍南县龙港镇新城工业启动区海景路8号二车间中间
柘城县盛和无纺布制品有限公司,100万元人民币,河南省商丘市柘城县岗王乡东吕庄84号
义乌市巨拓无纺布厂,-,义乌市巨拓无纺布厂
金湖泰亚无纺布科技有限公司,600万美元,金湖县金北镇工业集中区兴工路8号
高碑店市帛隆无纺布有限公司,50万元人民币,高碑店市高桥村东
黄岛区龙翔无纺布经销处,-,黄岛区龙翔无纺布经销处
鞍山市金达无纺布有限公司,50万元人民币,鞍山市铁西区居义街57号
广州玉洁无纺布有限公司,50万元人民币,广州市白云区鹤龙街道鹤边员村南街3号2栋102房(自主申报)
晋江宝裕无纺布科技有限公司,600万元人民币,福建省泉州市晋江市西滨镇海滨工业区邮电局旁
承运无纺布（湖州）有限公司,100万元人民币,浙江省湖州市长兴县夹浦镇香山工业集中区
仙桃市自如无纺布有限公司,10万元人民币,仙桃市彭场镇芦林湖农业示范园特1号
安新县万涛无纺布厂,-,安新县万涛无纺布厂
苏州柔织无纺布有限公司,200万元人民币,吴江区震泽镇新幸村6组
苍南县先胜无纺布厂,-,苍南县先胜无纺布厂
上海意东无纺布制造有限公司,250万元人民币,浦东新区浦星公路69号
太仓市顺发无纺布厂,28万元人民币,太仓市顺发无纺布厂
河北汇裕无纺布制品有限公司,500万元人民币,河北省邢台市巨鹿县河北巨鹿经济开发区(鲁班路以北197米、3号路以东274米)
山东盛源无纺布有限公司,1000万元人民币,济南市莱芜高新区原山路北段山东钢峰工业园
